character,line
T'CHALLA,Don't worry about it. You're doing great. Panther leaps back onto the hood of the Lexus and they speed off. Klaue looks back as Nakia closes in. The driver f l oors it as a GUNMAN in the THIRD SUV opens fire on Nakia's Lexus. The bullets carom off the hood. Nakia and Okoye... unfazed by the gunfire.
OKOYE,Guns. So primitive. Klaue barks into his comm.
KLAUE,"It ' s a vibranium car you idiots!! Bullets won't penetrate!! Okoye slides out the passenger window and climbs onto the roof, stabbing her short spear into the top of the vehicle as a handle, her dress blowing in the wind."
NAKIA,What are you doing?
OKOYE,Just drive.
NAKIA,"Eesh. Nakia drops back and weaves through traffic as Okoye, engages her SPEAR MECHANISM, then steadies herself and let's her long spear fly, launching the weapon like a javelin. The SPEAR rockets through the REAR AND FRONT WINDOW of the truck, SPIKING THE GROUND and bringing the SUV to a stop with the force of a head on collision!"
NAKIA,Wool
KLAUE,"Oh shoot. The SECOND and FOURTH SUV$ tear from the hills onto the DIAMOND BRIDGE with Panther's Lexus right behind them. Closing in, Panther takes Speeding through BUSY BRIDGE TRAFFIC, Panther surfs the roof of the BULLET RIDDLED LC."
SHURI,"Hey, look at your suit! You' ve been taking bullets charging it up with kinetic energy! Panther looks down at the GLOWING GLYPHS of kinetic energy built into his suit as..."
T'CHALLA,"Pull around the truck. The LC accelerates ahead, closing in on the SECOND SUV, but just as Panther is about to look inside, a passing TRAILER BLOCKS his view. The 4Runner loses sight of Panther as he LEAPS TO THE TRAILER, bounding across the top of the big rig separating the Lexus and the 4Runner. Klaue ' s gunmen search furiously for Panther as the Lexus LC suddenly cuts in front of them, without Panther on to p."
DRIVER,"Where'd he go!? Then out of nowhere, PANTHER LANDS HARD on the hood of the Looking inside, Panther doesn't see Klaue and launches off the 4Runner, distributing the kinetic energy from his suit with IMMENSE CONCUSSIVE FORCE, causing both TRUCKS TO CRASH and FLIP down the bridge. Shuri swerves the Lexus, skillfully catching Panther on the roof again as..."
SHURI,You show off. Nakia's Lexus sedan trails Klaue's 4Runner. •. both going airborne over hilltops.
NAKIA,"There he is! Hold tight! As the SUV catches air over a rise in the road, Klaue slides his body out of the truck."
KLAUE,"Right, let's have some fun. Sitting on the windowsill, Klaue aims his Nakia is locked in and Okoye prepares to throw her SPEAR again but they suddenly LOSE SIGHT of Klaue as the Lexus hits the rise. Ahead, Klaue's 4Runner launches off a second, Nakia loses sight of Klaue again as... The SUV LANDS HARD on the downside of the hill. Klaue, still at speed, steadies his disrupter and as NAKIA'S LEXUS appears in MID-AIR over the rise, he FIRES. Klaue's SONIC SHOT hits the Lexus sedan head on and piece by piece to its studs... SENDING NAKIA As she twists through the air, her feet remain planted on a shredded piece of the cars' roof. She l ands on her feet, speed-skating to a stop. Nakia skids up next to Okoye on the driver's seat, still buckled in. Ross pulls up in a SUBURBAN and stops in front of Nakia and Okoye."
ROSS,Hop in. Put that spear in the trunk.
T'CHALLA,"Faster, Shuri. Tracking Kla ue ' s SUV, Shuri drives in the sand cockpit."
SHURI,"I ' m going as fast as I can! We see KLAUE' S 4RUNNER racing across the Centum City Bridge... the Diamond Bridge can be seen in the background. Klaue is back inside the SUV as it WEAVES through traffic. Then, we spot a rapidly closing LEXUS LC WITH PANTHER on the roof. Klaue turns to his driver."
KLAUE,"Take a right, take a right! Klaue ' s 4Runner and Panther's LC make left turns, booking down a short road, then make quick rights. The 4Runner barrels along a brightly lit TWO LANE ROAD with the Lexus LC chasing. Unnerved seeing Panther closing in, Klaue slides his body back out to the SUV's windowsill as his driver makes a sharp right onto a WIDER AVENUE. Determined, Shuri rounds the turn, focused. The DIGITAL DASH shows 115 mph and climbing. But, hanging out of the truck, Kla ue fires a MASSIVE SONIC BLAST that Shuri can't evade."
SHURI,No no no no no no no!! And... HIT... t he LEXUS LC SUDDENLY GOES TO PI ECES... whole parts and panelling to a million fragments. Shuri ' s driver seat and she hits the floor.
SHURI,"Brother! But PANTHER... launches himself out of the DISASSEMBLING CAR to ward a BUILDING and in fo ur strides al ong the side of the structure, he LEAPS OFF at KLAUE' S 4RUNNER. Klaue's driver spots PANTHER FLYING AT THEM and tries to swerve, but Panther LATCHES to the side of the SUV and DIGS IN with his claws. Panther GRABS THE RIM of the front tire and STOPS THE WHEEL dead in its tracks! The lug nuts SHEAR OFF from the force and Panther discards the tire, causing the truck's nose to CRASH DOWN, skidding across the street with Panther ROLLS clear as the 4RUNNER HITS the curb, FLIPS OVER to its roof and SLIDES TO A STOP in the middle of a busy outdoor cafe as its PATRONS scramble. With the SUV upside-down and customers looking on, Panther approaches to find Klaue struggling to climb out of his window."
T'CHALLA,"Klaue 11 Klaue slowly gets to his feet and tries to level his disrupter but running up, Panther evades the BLAST and is only nic ked on the shoulder. Panther grabs Klaue's arm, CLAWING into the sonic disrupter and COMPLETELY PULLS IT OFF."
T'CHALLA,Did you think we would forget!? Klaue laughs.
T'CHALLA,Look at me murderer! Where did you get this weapon?
KLAUE,You savages didn ' t deserve it. T'Challa grabs him by the throat and slams him into the
KLAUE,"Oh, mercy! King, mercy! Seething, Panther exposes his claws prepared to strike."
T' CHALLA,Every breath you take is mercy from me.
OKOYE,King/ T'Challa turns to find Okoye and Nakia getting out of Ross' Suburban.
NAKIA,The world watches. The pier has crowded with Koreans RECORDING them on cellphones as SIRENS can be heard in the distance.
ROSS,"Come on guys, let's go huh? T'Challa eyes around. He has little choice and nods. Fast-paced, loud and dirty. SOUTH KOREAN EMPLOYEES busily work at desks. Nakia is among them, watching the passing cars. Guard duty. Agents and CIA analysts move about. On the table sits PROSTHETIC WEAPON and THE VIBRANIUM sitting atop the paper bag. Klaue, strapped to a chair, makes faces at the two way glass."
KLAUE,"Hello! I can see you! I can, I can see you."
ROSS,"So, this is a big mess, huh? I figured we can go good cop bad cop. I'll talk to him first, then you guys go in -- Okoye turns to T'Challa."
OKOYE,We can't let him talk to Klaue alone.
T'CHALLA,Better to let him talk to Klaue alone for 5 minutes than to make a scene here. T'Challa turns to Ross.
T'CHALLA,"After your questioning, we will to take him back to Wakanda with us. Ross stares at T'Challa for a beat."
ROSS,"What? No. Look I like you, a lot. But he's in my custody now. He's not going anywhere. Listen, I 'm doing you a favor by letting you even be in here. Ross reaches out and touches T'Challa. Okoye steps in."
OKOYE,"If he touches you again, I am going to impale him to this desk. Ross looks at Okoye, sensing the thinly veiled threat. He looks to T'Challa."
ROSS,Does she speak English?
OKOYE,When she wants to. Ross and Okoye eye each other for a long beat.
ROSS,"I'm going in. And when I'm done, you guys are up."
T'CHALLA,--Agent Ross.
ROSS,Yea. T'Challa puts his hand on Ross's shoulder.
T'CHALLA,I do appreciate your help in Busan.
ROSS,"You see that? It's called diplomacy. You're welcome. Ross walks through the door, closing it behind him."
T'CHALLA,Okoye! Play nice.
OKOYE,"Eh, Americans... Strapped to his chair, Klaue sings."
KLAUE,"You know, you really shouldn ' t trust the Wakandans. I'm much more your speed."
ROSS,"I don't trust anybody, not in this job. But what I am interested in is that arm cannon out there. Where'd you get that?"
KLAUE,It's an old mining tool that I made some adjustments to. But I can get you one if you'd like.
ROSS,Why don't you give me the name of your supplier and I'll ask them.
KLAUE,"He's right outside, why don't you ask him yourself?"
ROSS,T' Challa? You're telling me that weapon on your arm is from Wakanda? Klaue nods.
KLAUE,Bingo.
KLAUE,What do you actually know about Wakanda?
ROSS,Shepherds. Textiles. Cool outfits. Ross stops as we notice a MICRO AUDIO BUG on his shoulder that T'Challa planted before he entered the room. T'Challa and Okoye secretly listen to Klaue's interrogation.
KLAUE,"It's all a front. Explorers searched for it for centuries. El Dorado : The Golden City. They thought they could find it in South America, but it was in Africa the whole time. A technological marvel. All because it was built on a mound of the most valuable metal known to man- Isipho- they call it. The gift. Vibranium..."
ROSS,Vibranium yea. Strongest metal on Earth.
KLAUE,"It's not just a metal... They sew it into their clothes, it powers their city, their tech, their weapons..."
ROSS,Weapons?
KLAUE,Oh yes. Makes my arm cannon look like a leaf blower.
ROSS,That's a nice fairy tale but Wakanda is a third world country and you stole all their vibranium.
KLAUE,I stole all of it? Klaue can barely contain himself.
KLAUE,All of it? I took a tiny piece of it. They have a mountain full of it. They've been mining it for thousands of years and still haven't scratched the surface.
KLAUE,"I'm the only outsider who's seen it, and got out of there alive.  If you don't believe me you ask your friend what his suit is made of... what his claws are made of... Ross looks back at the two way glass, then heads towards the door. ROSS exits the interrogation room and approaches T'Challa and Okoye. Lirnbani drives wi th Linda in the passe nger seat. Attached to the dashboard is a GPS TRACKING TABLET DEVICE with a blinking BEACON  inside the travel agency. We also see everyone's HEAT SIGNATURE, including Klaue seated alone. Through the FRONT WINDOW, Nakia watches a PAINT TRUCK pass the building that doesn't seem right. Ross studies T'Challa."
ROSS,Your father to l d the UN that Klaue stole all the vibraniurn you had. But now he's telling me you have more?
T'CHALLA,"And you believe the word of an arms dealer, strapped to a chair. Ross hesitates, but doesn ' t bite. The truck pulls to a stop at the rear of the building. Killmonger emerges from the back of the truck with an ASSAULT RIFLE with a GRENADE LAUNCHER ATTACHMENT. On a computer monitor, we see SECURITY CAMERA FEEDS from outside the black site. Nakia wanders past the desk, eyeing over a travel agency employee's  shoulder and freezes. SECURITY CAMERA FEED the alley is empty, but there is a VISIBLE GLITCH in the footage."
NAKIA,Where is that?
CIA AGENT,"Back there. He points in the direction of the interrogation room. Killmonger slips on the AFRICAN MASK from the British Museum, then carries a DAISY-CHAIN OF EXPLOSIVES toward the building. He sets the CHARGES against the outer wall of Klaue ' s room and fearlessly leans against the structure next to the charges, he holds a detonator in his hand as Linda and Limbani lean against the wall next to him."
ROSS,How much more are you hiding? Then suddenly... Nakia SLAMS through the door. CIA AGENTS draw their weapons. Nakia is unfazed.
NAKIA,"Something's happening out back. Then... •.. carving a hole in the wall. Startled... they all break for the interrogation room but. •. Killmonger suddenly spins inside, laying down cover fire, WITH BULLETS and SHATTERING THE TWO-WAY Besieged with automatic GUNFIRE, everybody DUCKS down. On instinct, Ross shoves Nakia to the floor, taking a round to the back, saving her while... T'Challa's SUIT FORMS and he shields a CIA Agent. Okoye dives clear of the doorway and the other agents scramble out into the travel agency for cover. Linda and Lirnbani GRAB KLAUE carrying his entire chair with him still strapped to it as... Edging back toward the breach, Killmonger throws a live GRENADE through the shattered two-way window into the black site office. Panther instantly dives on the grenade and it EXPLODES, doing no damage to him or the room, but lights up his entire suit. Panther bounds back to his feet to give chase as... Klaue cackles maniacally being loaded into the paint truck by Linda and Lirnbani."
KLAUE,"I see you took your time didn't you! Killmonger continues to FIRE as Lirnbani and Linda hop in and begin to pull off. Walking backward after the truck, Killmonger swings the RPG up to his shoulder as Panther emerges. The truck turns out of the alley as Killmonger aims. Panther charges at Killmonger and he FIRES! Taking the ROCKET head on, Panther is ENGULFED IN THE MASSIVE IMPACT and blown backward. Panther's suit is lit to the max with kinetic energy as he labors back to his feet, he spots the RING dangling around Killmonger's neck on his gold chain. ."
OKOYE,My King! Panther turns to find Okoye.
OKOYE,"My King... Nakia. Panther and Okoye enter discovering agents and Nakia hovering around Ross on the floor. The receptionist  applies pressure to his gunshot wound as a MALE CIA AGENT checks his pulse. Shaken, Nakia looks to Panther."
NAKIA,"He just jumped in front of me. Gravely wounded, Ross is barely conscious."
NAKIA,"I don't think he'll make it here, it hit his spine."
T'CHALLA,Give me a Kimoyo bead. T'Challa looks at Nakia and motions towards her Kimoyo bead. She pulls one off and hands it to him. T'Challa inserts it into Ross' wound.
T'CHALLA,This will stabilize him for now.
T'CHALLA,"Give him to us. We can save him. The agents stare at Panther and his glowing high-tech suit. Okoye is at the helm with Nakia standing next to her. Neither can believe Ross is on board. Further back in the aircraft, we find Ross' unconscious body. T'Challa looms nearby, lost in thought."
OKOYE,Our missions was to bring back Klaue. We failed. This man is a foreign intelligence operative. How do we justify bringing him into our borders?
NAKIA,He took a bullet for me.
OKOYE,"That was his choice. T'Challa stiffens. Okoye has gone a little too far. Torn, Nakia stares off, thinking about the Nigerian women they didn't bring back to Wakanda and her culpability in Ross' injury."
NAKIA,So now we are just supposed to let him die?
OKOYE,"Let us consider that we heal him. It is his duty to report back to his country. And as King, it is your duty to protect ours."
T'CHALLA,"I am well aware of my duties, General. I cannot just let him die knowing we can save him."
OKOYE,"Where exactly are we taking him? Shuri covertly l eads T'Challa, Okoye and Nakia inside, carrying Ross ' s body on a Maglev stretcher. She turns to T'Challa."
SHURI,"Great, another broken white boy for us to fi x. This is going to be fun. T' Challa cuts Shuri a look. Ros s is placed on a table surrounded by futuri stic medical equipment. As Shuri works on him."
SHURI,He will live. The security alarm on Shuri's Kimoyo bead GOES OFF.
SHURI,"W'Kabi is here. Shuri, Nakia and Okoye quickly hide. T'Challa hurries up the ramp. Hoping for good news, W' Kabi approaches T'Challa."
W'KABI,"What ' s going on, brother? Where is Klaue?"
T'CHALLA,He's not here. T'Challa's eyes lower regretfully.
T'CHALLA,He slipped through our hands.
W' KABI,"Slipped? For 30 years your father was in power and did nothing. With you I thought it would be different. But it's more of the same. Deeply disappointed, W' Kabi can't muster words. He looks at T'Challa and wal ks out. An airplane graveyard. The paint truck pulls to a stop on the airstrip. Killmonger, Klaue, Limbani and Linda hop out, and hump their gear to a FOUR- SEATER ESCAPE PLANE parked on the airstrip."
LIMBANI,"Let's get going, boss."
KILLMONGER,You always sell to the CIA?
KLAUE,"I sell to the highest bidder. Don' t you worry when I get back to Jo- burg and lay low for a bit, I ' ll make sure both you guys get paid."
KILLMONGER,"Oh I ain't worried about the money, bro. I know you're good for it. Klaue smiles."
KILLMONGER,"On our way back, just drop us of in Wakanda."
KLAUE,"You don't wanna go there, boy."
KILLMONGER,"Yea I do. Killmonger suddenly draws a HANDGUN and SHOOTS LIMBANI DEAD. Reacting to the shot, Klaue crowds Linda with a skilled GRAPPLING MOVE and snatches her gun away before she can fire on him. Killmonger finds Klaue holding Linda's gun to her head, using her as his shield."
KLAUE,"Drop it, or your little Bonnie and Clyde routine ends today. Put your gun down now!"
LINDA,"I'm sorry. I'm sorry, Erik."
KILLMONGER,"It's gonna be ok. Killmonger fires without hesitation. The BULLET TRAVELS THROUGH Linda, ki lli ng her while Klaue dives behind the plane, WOUNDED IN THE SHOULDER from the round. Killmonger moves to finish Klaue but he's gone. Following Klaue's blood trail, Killmonger STALKS Klaue through the Klaue fires at Killmonger, missing. Killmonger stops and turns, ducking between planes. Killmonger spots Klaue THROUGH THE GLASS of a cockpit window and FIRES. Sniped through the window with precision, Klaue falls, losing Linda's gun. Ki l lmonger approaches and Klaue rolls to his back to face him."
KLAUE,... Y-You really wanna go to Wakanda? They're savages. Klaue shows his BRANDED neck.
KLAUE,This is what they do to people like us.
KILLMON,
GER,"I ain't worried about no brand. Check these out. Killmonger rolls up his sleeve, uncovering SCARIFICATION MARKS on his forearm."
KILLMONGER,Each one is for a kill.
KLAUE,"You can sca r yourself as much as you like. To them, you'll just be an outsider. You're crazy to think that you could walk in there. Killmonger flips the inside of his bottom lip, revealing a glowing Wakandan TATTOO. Klaue can't believe his eyes."
KLAUE,"And to think I saw you as some crazy American. Klaue starts laughing, hard. Killmonger aims and pulls the trigger at point blank range. T'Challa enters to find Zuri tending to the garden. He looks around to the other Shamans."
T' CHALLA,Leave us. They immediately head out. zuri turns to T'Challa.
ZURI,So your mission did not go as planned.
T'CHALLA,"What happened to my Uncle N'Jobu? My father told me he disappeared... there was a man today wearing a ring identical to this one. Zuri turns back and T'Challa lifts his hand, showing his VIBRANIUM RING from CA:CW. zuri turns away uncomfortable."
ZURI,That is not possible.
T' CHALLA,He helped Klaue escape from us and he was wearing this ring. My grandfather ' s ring. Do not tell me what is possible tell me the truth.
ZURI,"Some truths are too much to bear, T'Challa."
T'CHALLA,That is not your choice to make. What happened to him?
ZURI,I promised the King to say nothing.
T'CHALLA,I am your King now! Zuri looks up.
ZURI,"Your uncle took a War Dog assignment in America. Your father placed me there to observe unbeknownst to him. Your uncle fell in love with an American woman. They had a child. The hardships he saw there radicalized your uncle. N'JOBU makes his plea to YOUNG T'CHAKA, picking up where we left off in the Oakland sequence."
N'JOBU,"I observed for as long as I could! Their leaders have been assassinated, communities flooded with drugs and weapons, they are overly policed and incarcerated. All over the planet our people suffer because they don't have the tools to fight back. With vibranium weapons they could overthrow every country and Wakanda could rule them all, the right way..."
ZURI,"He knew your father would not support this, so your uncle betrayed us."
T'CHALLA,No. •.
ZURI,He helped Klaue steal the vibranium.
T'CHALLA,No no no no no no... Young T'Chaka turns to N'Jobu.
YOUNG T'CHAKA,"You will return home at once, where you will face the council and inform them of your crimes. N'Jobu reaches into his waistband and pulls a HANDGUN, aiming it at James/Young Zuri's head, freezing him."
ZURI,"He drew his weapon on me Young T'Chaka pops his claws. He quickly springs forward, digging his CLAWS into the slide and destroying it, before he can pull the trigger. He then buries his CLAWS into N'Jobu's chest, killing him instantly. He lets N'Jobu's body drop to the floor, and closes his eyes."
ZURI,Your father killed his own brother...
ZURI,To save my life. Young Zuri looks at Young T'Chaka with tears welling up in his eyes.
YOUNG T'CHAKA,Speak nothing of this.
T'CHALLA,And the child...
ZURI,"We left him. One of the young kids playing basketball, who is now revealed to be YOUNG KILLMONGER stands looking up at the sky where the mysterious lights flickered."
ZURI,"We had to maintain the lie. Gutted, T'Challa can't reconcile what he's just heard. He turns his back on Zuri. Dragging a LARGE BAG, Killmonger approaches. In the distance, we see the four-seater plane. W'Kabi approaches as Killmonger drops the bag."
W'KABI,What is this?
KILLMONGER,"Just a 'lil gift. Killmonger opens his bag, revealing KLAUE'S CORPSE. W'Kabi's eyes widen, and his men draw their swords."
W'KABI,Who are you? Ross suddenly opens his eyes and reaches for his gunshot wound finding it astonishingly almost fully healed. Shuri tinkers with the circuitry of a PAIR OF MASSIVE CLAWED VIBRANIUM GAUNTLETS across the room as Ross sits up.
ROSS,"Alright, where am I? Startled, Shuri spins."
SHURI,"Don't scare me like that, colonizer."
ROSS,Colon-who? My name is Everett.
SHURI,"Yes, I know. Everett Ross former airforce pilot and now, CIA."
ROSS,"Right. Groggy, Ross gazes around at the completely unique technology."
ROSS,"Ok, is this Wakanda?"
SHURI,"No, it ' s Kansas."
ROSS,... How long ago was Korea?
SHURI,Yesterday.
ROSS,I don't think so. Bullet wounds don't just magically heal overnight.
SHURI,"They do here. But not by magic, by technology.  Don't touch anything. My brother will return soon. Leery, Shuri watches Ross wander about out of the corner of her eye. He walks over to the observation deck and gazes in awe at the exposed GLOWING ROCKS inside of the VIBRANIUM Suddenly an AUTOMATED MINING CART whips between light panels, floating above a rail."
ROSS,"These train things... that's magnetic levitation, right?"
SHURI,Obviously.
ROSS,"Obviously... but I've never seen it this efficient. The light panels, what are they?"
SHURI,Sonic stabilizers.
ROSS,Sonic what?
SHURI,"In it's raw form, vibranium is too dangerous to be transported at that speed, so I developed a way to temporarily deactivate it."
ROSS,There's vibranium on those trains?
SHURI,There is vibranium all around us. That's how I healed you. Ross tries to process this unexpectedly forms.
OKOYE'$ PROJECTION,"Where is T'Challa? His Kimoyo beads have been switched off. Ross, amazed, tries to touch the sand projection."
SHURI,"Well we are not joined at the hip, Okoye."
OKOYE'$ PROJECTION,A man showed up at the border who claims to have killed Klaue.
SHURI,What?
OKOYE'$ PROJECTION,W'Kabi is transporting him as we speak to the pa l ace. We need to find your brother.
SHURI,An outsider?
OKOYE'$ PROJECTION,"No, a Wakandan. An IMAGE OF KILLMONGER from the border appears on Shuri's monitor. Then... Ross slowly walks into sight, staring at the screen."
ROSS,He's not a Wakandan. He's one of ours. T'Challa and Nakia gaze out off the side of a beautiful overlook.
T' CHALLA,He killed his own brother... and left a child behind with nothing. What kind of King •.. what kind of man does that?
NAKIA,No man is perfect. Not even your father.
T'CHALLA,"He didn ' t even give him a proper burial... My Uncle N'Jobu betrayed us, but my father may have created something even worse."
NAKIA,Hey. Look at me. You can't let your father ' s mistakes define who you are. You get to decide what kind of King you are going to be. They share a look as T'C hal la's Kimoyo beads buzz.
SHURI'S PROJECTION,"Brother, you need to get here now. T' Chall a and Nakia look at each othe r. T'Cha l la, Shuri and Nakia listen as Ross briefs them on Killmonger. A BODY SCAN IMAGE of Killmonger is on Shuri's monitor."
ROSS,Eric Stevens. Graduated Annapolis age 19. MIT for grad school. Joined the SEALs and went to Afghanistan where he racked up confirmed kills like it was a video game. They started calling him Killmonger. He joined a JSOC ghost unit.
ROSS,Now these guys are serious. They will drop off the grid so they can commit assassinations and take down governments.
T'CHALLA,Did he reveal anything about his identity?
SHURI,"He has a War Dog tattoo but we have no record of him. T' Challa and Shuri share a look. T'Challa sits on his throne surrounded by the Tribal Elders, Ramonda, Shuri, Okoye, and the Dora."
RIVER TRIBE ELDER,Is this man Wakandan or not?
MINING TRIBE ELDER,Tell us what is going on. Killmonger is escorted in by W'Kabi. W'Kabi tensely steps next to T'Challa as Killmonger takes his place before the circle.
T'CHALLA,Speak.
W' KABI,Speak.
KILLMON,
GER,I'm standing in your house. Serving justice to a man who stole your vibranium and murdered your people. Justice your King couldn't deliver. T'Challa walks close enough to Killmonger to be able to whisper to him.
T'CHALLA,"I don't care that you brought Klaue, the only reason I don't kill you where you stand is because I know who you are... now what do you want?"
KILLMON,
GER,I want the throne. The entire room scoffs at this. Some ELDERS even hold their heads back and laugh.
MINING TRIBE ELDER,My goodness.
KILLMONGER,"Y'all sittin' up here comfortable. Must feel good. There's about billion people all over the world that looks like us but their lives are a lot harder, Wakanda has the tools to liberate them all."
T'CHALLA,And what tools are those?
KILLMONGER,Vibranium. Your weapons.
T'CHALLA,Our our weapons will not be used to wage war on the world. It is not our way to be judge jury and executioner for people who are not our own.
KILLMONGER,"Not your own? But didn't life start here, on this continent? So ain ' t all people your people?"
