character,line
ZURI,"Let the challenge begin! The warriors CLASH, both with great skill. M'Baku with superior strength. T'Challa eludes a salvo of swings, then is driven back by the tip of M'Baku's spear against his shield. Knocking M'Baku's spear free, T'Challa is HAMMERED BACK but instantly springs up to dodge more attacks and counter with M'Baku spits blood and bangs his chest. The rest of the Jabari warriors RESPOND. T'Challa salutes the crowd and they respond M'Baku charges at T'Challa, knuckle-walking, and slipping his assault, T'Challa grabs M'Baku's spear and cartwheels over it to land another The two continue to battle, BLOCKING and TRADING BLUNT STRIKES, until M'Baku delivers a backhand that T'CHALLA OFF HIS FEET near the Dora's spears. With the deadly spears at his back, T'Challa blocks OVERHEAD BLOWS with his shield, then M' Baku leans with all his strength trying to impale T'Challa on the TIPS. Clubbing M'Baku to his heels, T'Challa rushes forward for an aerial attack only to be met by a VICIOUS KICK to the chest, causing him to LOSE both his shield and spear!"
M'BAKU,"Where is your God, now?! Defenseless, T'Challa DODGES SPEAR-SWIPES before M'Baku corrals him into a BEAR HUG and delivers a CRUSHING HEADBUTT. M'Baku LAUGHS through his mask."
M'BAKU,"No powers. No claws. No specia l suit, oh! Just a boy, not fit to lead. From T'Challa's POV we see Ramonda cheering from the sidelines."
RAMONDA,"Show him who you are! T'Challa finds strength in RAMONDA'S VOICE. He shakes off the headbutt, stunning M'Baku with a SAVAGE ELBOW to free himself. M' Baku retaliates, GORING T'Challa's shoulder."
T'CHALLA,I AM PRINCE T'CHALLA SON OF King T'CHAKA! l
SHURI,"You can do this T'Challa! T'Challa wedges M'Baku ' s spear UNDER HIS FOOT and PULLS M'Baku to the pool, FLIPPING his body into a SERIES OF LEG M'Baku FIGHTS, but can't escape."
T'CHALLA,Yield! Don't make me kill you.
M'BAKU,I would rather die! T'Challa TIGHTENS HIS GRIP and M'Baku begins to fade.
T'CHALLA,What would the proud Jabari do without you? T'Challa tightens further.
T'CHALLA,"You have fought with honor, now yield! Your people need you. M'Baku looks up at the Jabari warriors."
T'CHALLA,"Yield, man! M' Baku grudgingly reaches out and TAPS. T'Cha l la lets him go and is barely ab l e to stand hi mself as Zuri steps forward. The crowd ERUPTS as struggling to catch his breath, T'Challa proud l y lifts his ar m."
ZURI,"I now present to you, King T'Challa the Black Panther!!"
T'CHALLA,Zuri.
ZURI,My King. Drums begin to play and people start to dance. T'Challa and Nakia stare into each other's eyes amidst the celebration as…
T'CHALLA,"Wakanda forever!! The arena ECHOES THE PHRASE emphatically. We move in on the Hal l of Kings. zuri, wearing ceremonial face paint, mixes a Heart Shaped Herb concoction and pours it into T'Challa's mouth as he lies in a dirt plot in the middle of the room."
ZURI,Allow the Heart Shaped Herb to restore the powers of the Black Panther and take you to the Ancestral Plane. T'Challa closes his eyes.
ZURI,"T'Chaka, we call on you. Corne here to your son. We see YOUNG T'CHALLA and YOUNG T'CHAKA smiling at each other. We see images of T'Challa and T'Chaka from CA:CW. Father puts a hand to his son ' s face lovingly. T'Challa, eyes closed, struggles with the memories as he slips into the Ancestral Plane."
ZURI,"Darnaku. The children begin burying T'Challa in the red sand. The explosion from CA:CW kills T'Chaka, and we see T'Challa crawling towards him, then cradling him in his arms. T'Challa puts on his father's ring. zuri is the last thing T'Challa sees as his face is buried. T'Challa comes out of the dirt. There are stars above. He's in a VAST GRASSLAND somewhere in Wakanda with wondrous acacia trees. It's surreal and beautiful. A massive ACACIA TREE stands in front of him. T'Challa sees several YELLOW EYES looking at him and realizes PANTHERS are resting on the branches of the tree. T'Challa approaches. large panther jumps down, then stands on two feet to reveal it's T'Challa lo oks at his father and immediately pulls him into a hug."
T'CHALLA,Baba!
T'CHAKA,"My son. T'Challa kneels down before his father, overcome with grief."
T'CHALLA,I am sorry.
T'CHAKA,"Stand up! You are a King. T'Challa rises, and they begin to walk."
T'CHAKA,What is wrong my son?
T'CHALLA,"I am not ready, Baba."
T'CHAKA,"Have you not prepared to be King your whole life? Have you not trained and studied, been by my side?"
T'CHALLA,That is not what I am talking about. I am not ready to be without you.
T'CHAKA,A man who has not prepared his children for his own death has failed as a father.  Have I ever failed you?
T'CHALLA,"Never.  Tell me how to best protect Wakanda. I want to be a great King, Baba. Just like you."
T'CHAKA,You're going to struggle. So you need to surround yourself with people you trust. You're a good man with a good heart. And it's hard for a good man to be King. T'Challa is aggressively pulled from the dirt by Zuri.
ZURI,"Breathe, T'Challa. Breathe! T'Challa breathes in deeply, coughing up dirt. His battle wounds have healed."
T'CHALLA,He was there! He was there. My father. A bustling futuristic metropolis. T' Challa and Nakia stroll side by side. FOUR DORA MILAJE shadow them from a distance.
T'CHALLA,"Corne home, Nakia."
NAKIA,I'm right here.
T'CHALLA,Stay.
NAKIA,"I came to support you, and to honor your father. But I can't stay. It's just...! found my calling out there. I've seen too many in need just to turn a blind eye. I can't be happy here knowing that there's people out there who have nothing. T'Challa thinks on this."
T'CHALLA,What would you have Wakanda do about it? Nakia thinks for a bit.
NAKIA,"Share what we have. We could provide aid and access to technology and refuge to those who need it... other countries do it, we do it better."
T' CHALLA,"We are not like these other countries, Nakia. If the world found out what we truly are, and what we possess -- we could lose our way of life."
NAKIA,Wakanda is strong enough to help others and protect ourselves at the same time. Nakia gives T'Challa a look.
T'CHALLA,If you were not so stubborn you would make such a great queen.
NAKIA,I would make a great queen because I am so stubborn.
T' CHALLA,Ah! So you admit it!
NAKIA,"… if that's what I wanted! We TRACK PAST several Border Tribesmen in a field, feeding and watering their pet HORSES and GOATS. Finally we come upon... W'Kabi feeding M20, his RHINO by hand. T'Challa stands beside him."
T'CHALLA,"Is that him? Glory to Bast, man, is he still growing? W'Kabi laughs."
W'KABI,Of course.
W'KABI,I see Nakia is back... you guys going to work it out? T'Challa shakes his head and crosses in front of W'Kabi.
W'KABI,"T'Challa, what's wrong?"
T'CHALLA,Nakia thinks we should be doing more.
W'KABI,More like what?
T'CHALLA,Foreign aid... refugee programs. W'Kabi shakes his head.
W'KABI,"You let refugees in, they bring their problems with them. And then Wakanda is like everywhere else. T'Challa thinks on this."
W'KABI,"Now, if you said you wanted me and my men to go out there and clean up the world, then I'd be all for it."
T'CHALLA,"But waging war on other countries has never been our way. Then, both of their Kimoyo beads buzz."
T' CHALLA,"You too, huh?"
W'KABI,"Bast, are we in trouble? Their beads combine to project a display of Okoye."
OKOYE,"My King. My love. You will never guess who just popped up on our radar. An ornate chamber overlooking the Golden City. At the top of a golden pyramid, T' Challa, W'Kabi, Ramonda and ELDERS from each tribe except the Jabari sit in a circle as Okoye briefs them. W'Kabi and Ramonda flank T'Challa's throne."
OKOYE,A misidentified Wakandan artifact was stolen yesterday from a British museum. We have learned Ulysses Klaue plans to sell the vibraniurn to an American buyer in South Korea tomorrow night. There are audible murmurs at the name of Ulysses Klaue.
T'CHALLA,Klaue has escaped our pursuits for almost 30 years. Not capturing him was perhaps my father's greatest regret. I wish to bring Klaue back here to stand trial.
MERCHANT,
TRIBE ELDER,Wakanda does not need a warrior right now. We need a King.
W'KABI,"My parents were killed when he attacked. Not a day goes by when I do not think about what Klaue took from us, from me."
OKOYE,It's too great an opportunity to pass.
W'KABI,"Take me with you. We'll take him down together side by side, eh?"
T'CHALLA,I need you here protecting the border.
W'KABI,"Then I ask, you kill him where he stands, or you bring him back to us."
T'CHALLA,"You have my word I will bring him back.  We will proceed with the mission. Ramonda looks on, irresolute. The Great Mound. Where a meteorite hit, creating a cliff-face on one side and a large hill on the other. A DRAGONFLYER lands outside the"
WAKANDAN,"T'Challa walks with four Dora, including Ayo. The Dora stop outside Shuri's Lab. As T'Challa pushes inside, Shuri approaches and bows her head."
SHURI,"My, King."
T'CHALLA,"Stop it. Stop it. Shuri laughs and they do a special handshake before walking down the spiral walkway into her sprawling, futuristic lab. Nexus of technology. Shuri strolls with T'Challa by work tables of high-tech weapons and gadgets."
SHURI,I've already sent a car ahead to Busan for you.  Who are you taking with you to Korea?
T'CHALLA,Okoye. And Nakia as well. Shuri makes a face at Nakia.
SHURI,You sure it's a good idea to take your ex on a mission?
T'CHALLA,"Yes. We'll be fine.  Besides, you will be on call, should we need backup. Shuri smiles at this and points out smal l communications devices."
SHURI,"I have great things to show you, brother. Here are your communication devices for Korea. Unlimited range, also equipped with audio surveillance system. She walks him over to another table with WDG disks on them."
SHURI,"Check these out. Remote access Kimoyo beads. Updated to interface directly with my sand table. Curious, T'Chal l a notices a pair of SLEEK SHOES."
T'CHALLA,And what are these?
SHURI,The real question is what are those? Why do you have your toes out in my lab? Shuri points at T'Challa's traditional sandals. T'Challa smiles.
T'CHALLA,"What, you don't like my royal sandals? I wanted to go old school for my first day."
SHURI,"Yea I bet the elders loved that. Try them on. T'Challa puts his feet into the shoes, and they lace up instantly, forming a perfect fit."
SHURI,"Fully automated, like the old American movie Baba used to watch. And I made them completely sound absorbent. T'Challa stomps his foot down without a sound."
T'CHALLA,Interesting •.•
SHURI,Guess what I ca l l them. T'Challa thinks on this.
SHURI,Sneakers... T'Challa looks at her blankly.
SHURI,"Because you... never mind. Shuri walks T'Challa over to two mannequins. One wears T'Challa's CURRENT SUIT. The other, just a panther tooth"
SHURI,If you're going to take on Klaue you'll need the best the Design Group has to offer. Shuri points at T'Challa's current suit.
SHURI,Exhibit A. Old tech.
T'CHALLA,"Old...? Functional, but old. Eh, people are shooting at me... wait let me put on my helmet... T'Challa smiles, amused."
T'CHALLA,Enough...
SHURI,Now look at these. T'Challa spots a GAUDIER GOLD TOOTH NECKLACE. She notices.
SHURI,Do you like that one?
T'CHALLA,Tempting. But the idea is to not be noticed. This one. Shuri uses her Kimoyo beads to sync the suit to T'Challa.
SHURI,"Now tell it to go on. T'Challa does, and without warning, MILLIONS of vibranium laced NANITES spill from the necklace and form a new BLACK PANTHER SUIT around the mannequin."
SHURI,Oooh!! The entire suit sits within the teeth of the necklace. Strike it.
T'CHALLA,Anywhere?
SHURI,Mhm. T'Challa turns to the mannequin in a relaxed fighting stance. Shuri nods and T' Challa SPIN KICKS the shit out of the mannequin!
SHURI,"Not that hard, genius!"
T'CHALLA,"You told me to strike it, you didn't say how hard. Shuri picks the mannequin back up and drags it over to the same spot."
SHURI,"I invite you to my lab, and you just kick things around."
T'CHALLA,"Well maybe you should make it a little stronger, eh? Shuri shrugs as we see Wakandan Script built into the suit GLOWING INDIGO where the impact of T'Challa's foot landed. T'Challa looks closely at the glowing script."
T'CHALLA,Wait a minute.
SHURI,The nanites absorb the kinetic energy and hold it in place for redistribu t ion.
T'CHALLA,Very nice.
SHURI,"Now strike it again, in the same spot. T'Challa backs up for a kick. Shuri presses record on her Kimoyo. T'Challa sees this and looks at her suspiciously."
T'CHALLA,You are recording?
SHURI,"For research purposes... T'Challa loads up then BOOM! He kicks the indigo spot and goes flying back across the room, CRASHING INTO A TABLE full of Shuri's gadgets. Shuri cracks up."
T'CHALLA,"Delete that footage... We move over the beautiful sky l ine. A LEXUS SEDAN drives through the market and pulls into a parking stall next to several expensive looking lu xury cars. T' Challa, Okoye and Nakia climb out of the sedan dressed to kill. A WIG covers Okoye's tattooed head."
NA.KIA,This way.
OKOYE,"Bast willing this goes quickly, and I can get this ridiculous thing off my head."
NA.KIA,It looks nice. Just whip it back and forth.
OKOYE,"What? It's a disgrace. Looky - loos stare as Nakia leads them to an ELDERLY WOMAN , se ll ing fish i n front of an al l ey. Nakia greets her in perfect Korean."
NA.KIA,"Hello Sophia, good to see you. Nakia smiles, but the Elderly Woman doesn't smile back."
ELDERLY WOMAN,Who are these two?
NA.KIA,My friends from Kenya. Very deep pockets. They're good.
ELDERLY WOMAN,"Good for trouble, like you? An awkward pause, then she smiles wearing a black suit emerges from the alley, and motions for the Wakandans to follow him into.."
NA.KIA,"Thank you. A small dark room with a A BACK DOOR with a Korean Character on it and TWO MORE KOREAN GOONS guarding each side. They eye our heroes closely. As they step through a large DETECTOR and are WANDED DOWN. The door opens and they pass into •.. They walk out onto the upper balcony of a buzzing, high-class casino. There are a few GAMING TABLES on the balcony level and a bustling pit down below."
T' CHALLA,Spread out. The buyer is likely already here. Okoye heads for the BALCONY VANTAGE POINT while T'Challa and Nakia go down to the FIRST FLOOR.
T'CHALLA,"The woman outside -- what trouble was she referring to? She plays along, alluring."
NAKIA,"Ah, I got into a disagreement with some ivory traders. Made a bit of a mess."
T' CHALLA,"And will there be any trouble tonight, Ms. Kenyan heiress?"
NAKIA,Depends on how quickly we finish the mission...
OKOYE,Can we please focus. T'Challa and Nakia split up. T'Challa heads for the pit and Nakia walks over to the bar.
OKOYE,Thank you. Nakia slips into a seat at the bar and looks around clocking the room.
NAKIA,"Over here. One whiskey, please."
NAKIA,"Eyes up. Americans. I count... three. We see Nakia's POV as she makes out THREE CIA AGENTS on the first floor, spread out under the balcony."
OKOYE,"Five. How could you miss Greased 
Lightning there behind you. Standing over the balcony looking, Okoye spots agents, both with greasy hair. An elegant waitress carries a tray of drinks to a CRAPS TABLE where we find T'Challa. The woman places the drinks down as T'Challa peers across the gambling pit at someone he recognizes and starts that way."
T'CHALLA,"Six. Just spotted an old friend who works for the CIA. It just got a little more complicated. T'Challa steps up to another crowded CRAPS TABLE next to EVERETT ROSS, the sixth CIA agent he spotted."
T'CHALLA,Agent Ross.
ROSS,Your highness. Ross plays it cool.
T'CHALLA,You are buying from Klaue...
ROSS,"What I'm doing or not doing on behalf of the US government is of none of your concern. Now, whatever the hell you're up to, do me a favor and stay out of my way."
T'CHALLA,I gave you Zemo.
ROSS,And didn't I kept it under wraps that the King of a third world country runs around in a bulletproof cat suit. I ' d say we were even. Ross places a Pass bet. T'Challa dumps a stack of chips on Don't Pass. All of the SHOOTER'S FRIENDS blow on the dice.
ROSS,"You really need to leave, now. They watch the dice roll. They land on 3. The dea l er takes away Ross' bet, and slides T'Challa's massive payout over to him."
T' CHALLA,"Klaue is leaving out that door with me. You've been warned. T'Challa walks toward another craps table, leaving the pile of chips behind ."
ROSS,"Hey, you won. Ross scratches his brow as a THIRSTY GAMBLER  who was sitting next to T'Challa grabs them. Ross eyes the Thirsty Gambler who shrugs."
THIRSTY GAMBLER,"You know what, I think I'll just take these, bring 'em over here and hold on for safe keeping. He slides them all onto the DON'T PASS bet and Ross walks off in search of T'Challa."
ROSS,"Ok heads up, the King of Wakanda is here. He cannot leave with Klaue. T'Challa stands at a ROULETTE TABLE when Ross walks up to him."
ROSS,"Alright, vibranium from the attack on Sokovia links back to a person that I'm not actually saying I'm here to make a deal with but that deal will not be called off. When the dust settles you and I can work something out."
T'CHALLA,"I am not here to make a deal. Ross rolls his eyes. SEVERAL BLACK 4RUNNERS pull up in f r ont of the Korean Woman and a platoon of EIGHT SOUTH AFRICAN TOUGHS dressed i n suits hop out of the trucks protecting Klaue. Klaue winks at the Korean Woman as he wal ks past her. She smi l es back and nods to the TOUGH behind her. Klaue and his men walk through the metal detector, and EVERY SINGLE ONE OF THEM LIGHTS IT UP. The TOUGHS watch as they go throug h. Klaue and his eight man entourage confidently stream inside the casino, spreading out across the ba l cony, gaining every va ntage poin t. At a stalemate. Then..."
NAKIA,Klaue plus 8! Ross looks to the entrance and immediately moves away from T'Challa. T'Challa watches Ross approach a third CRAPS TABLE. T'C halla turns his back to avoid being seen.
T' CHALLA,General.
OKOYE,In position to secure our exit.
T'CHALLA,And the vibranium. Who changes position from the bar to the CRAPS TABLE where T'Challa was initially standing.
NAKIA,I don't see it yet. As TWO OF KLAUE' S TOUGHS post up on either side of her on the balcony. She trie s to play it cool as they look around at the patrons suspiciously.
OKOYE,I thoug ht there were no weapons allo wed in here.
NAKIA,There's not supposed to be.
OKOYE,Someone did not get the memo. Definitely armed. Klaue spots Ross and smiles as he heads down the stairs flanked by a couple of his Ross keeps his cool as Kl aue approaches.
ROSS,Well that is quite the entourage. You got a mixtape coming out? Klaue cuts Ross a look.
KLAUE,"Yeah! Yeah, actually there is one. Shocked, Ross is unsure if Kl aue is serious."
KLAUE,Yea I'll send you the soundcloud link if you like. Klaue turns to one of his goons.
KLAUE,"Aye, Dave. Get him the link to the tape. The SOUTH AFRICAN TOUGH reaches into his pocket for his phone."
ROSS,"Please don't make me listen to your music. I just meant, you got a lot of people with yo u."
KLAUE,"Oh, you think they're for you? Klaue laughs at this."
KLAUE,"Don't worry. I can do a deal with you all by myself, thank you very much. He rubs Ross on the shoulder, hard, and for way too long. As several more SOUTH AFRICAN TOUGHS come pouring out of the VIP lounges."
NAKIA,"Six more, it ' s a set up."
KLAUE,You got the diamonds? Klaue is still rubbing Ross' shoulder.
ROSS,"Ok, that's enough. A CIA AGENT walks a FANCY SLIM BRIEFCASE towards Ross."
NAKIA,We need to move on Klaue.
T'CHALLA,Stand down. We can't afford a shoot- out. Ross eyes Klaue as the CIA agent brings him the briefcase.
ROSS,"The vibranium? Klaue looks around, and reaches into his pants and pulls out a wrinkled, sweaty paper bag, with FRAGILE written on it with a sharpie. Ross looks at the bag."
KLAUE,"I was going to buy a fancy suitcase, but I thought I'd save myself some money."
NAKIA,It's now or never. Nakia continues towards the CIA agent.
OKOYE,"STAND DOWN! A South African Tough hears her, and turns towards her."
SOUTH AFRICAN TOUGH,Hey. Okoye pretends she doesn't hear him.
SOUTH AFRICAN TOUGH,Hey!
OKOYE,"I've been made. Okoye starts for the stairs when ANOTHER TOUGH moves to cut her off. Okoye slows down and the TOUGH trailing behind her reaches out to grab her hand and turn her around. As soon as the goon touches Okoye, she TWISTS him into an ARM- BAR, throws her purse at the OTHER TOUGH and extends her spear, stabbing the OTHER TOUGH in the foot. She then throws her WIG into the ARM BAR TOUGH's face, and hurls him over the railing. The arm-bar tough CRASHES DOWN onto a gaming table behind Klaue and startled patrons, scramble in every direction. Klaue spins toward the commotion as... Klaue looks back to Ross and spots T'Challa. Producing a HANDGUN from his waist, Klaue opens fire on Ross and the CIA agent. Ross uses the SLIM SUITCASE as a shield as he ducks down below the craps table and... T'Challa leaps to action, KICKING and FLIPPING THE TABLE on its edge to block GUNFIRE from Klaue's other toughs. With bullets flying everywhere... PANICKED PEOPLE run for their lives. It's Surrounded by TOUGHS, Klaue retreats for the stairs."
KLAUE,"Get the diamonds, quick! EVERY ONE OF KLAUE'S TOUGHS unload, raining shells on the overturned craps table with Ross and T'Challa behind it. The TOUGHS move in only to have T'Challa leap from the table, staying low to FOOTSWEEP one onto his back. T'Challa kicks him back then disarms another TOUGH and kicks him into the bar. T'Challa then spins and kicks the next TOUGH over the roulette table and through the bar railing. Nakia grabs a goon in an ARM TWIST trying to relieve him of his gun. She takes off one shoe and knocks out another approaching gun. Swings the arm twisted goon to the floor, knocks him out, taking his gun and shooting up towards the balcony where Okoye is fighting. Okoye BATTLES TWO TOUGHS with her full-length spear, dropping both with proficiency. She kicks the gun away from one, fights another with her spear, then kicks a TOUGH over the rail. Okoye JUMPS down to the casino floor and stabs a goon on her way down, tucks and rolls. Okoye takes out a TOUGH with her spear. Nakia flips a TOUGH over her back. T'Challa sends a TOUGH and table flying. Beats down two more TOUGHS, he turns for more. T'Challa spots Klaue nearing the entrance and breaking away from the fight, LEAPS HALF WAY UP onto a column, bounds off to the UPPER BALCONY T'Challa lands 10 feet behind Klaue."
T'CHALLA,"Murderer! Klaue stops and turns around to face T'Challa. He tries to fire his gun but discovers he ' s out of ammo. Klaue smiles, dropping his gun and puts his hands up -- as KLAUE'S PROSTHETIC LEFT ARM suddenly splits open, revealing itself to be a SONIC DISRUPTER!"
KLAUE,"You know, you look just like your old man. T'Challa snatches up a ROLLING CHANGE CART TABLE just as Klaue fires the blaster at him.!!! A COLOSSAL SONIC BLAST hits the cart, blowing it to pieces and sending T'Challa RAILING back down into the pit. With money FLOATING in the air, T'Challa lands hard."
KLAUE,I made it rain! Nakia and Okoye make their way to the top of the stairs as… Klaue and FOUR TOUGHS exit with Nakia and Okoye giving chase.
KLAUE,"That was awesome! That was awesome! Let's go! Go, go, come on! Klaue jumps in the first of FOUR IDLING 4RUNNERS. The convoy instantly skids away as... Nakia and Okoye emerge. Okoye throws an EMP bead from her pocket and it lands on a parked"
NAKIA,Do we just leave him?
OKOYE,He'll catch up. Nakia starts the car and Okoye climbs in. T'Challa sprints out of casino.
T'CHALLA,Shuri! Shuri stands in front of a rectangular VIBRANIUM CASING that lowers. The SAND inside FORMS into the Lexus LC's cockpit.
GRIOT,Remote driving system activated.
SHURI,Yes yes yes! Wait... Which side of the road is it? We see a three-dimensional VIEW from inside the Lexus LC's cockpit appear as Shuri climbs in.
T'CHALLA,For Bast sake just drive!!!
SHURI,"Okay okay, calm down brother! HIS FACE... Black Panther. Panther continues running as the LEXUS pulls up behind him, at the last second he single-leg flips and lands on the hood of the Lexus LC, digging his HAND and BOOT claws into the hood as it"
SHURI,Wool Let's go! Klaue turns to the driver.
KLAUE,"Put some music on! What do you think this is a funeral? The 4RUNNERS cross through one intersection at speed, then make a hard right at the next INTERSECTION. Nakia remains on them as at the far end of the street we see PANTHER'S LEXUS LC join the chase. The CONVOY makes a right at a ""T"" and races down a TWO LANE STREET toward a split in the road. The FIRST and THIRD 4RUNNERS continue on the two lane street with NAKIA' S LEXUS SEDAN on their tail."
NAKIA,Which one is he in now? Klaue picks up his radio.
KLAUE,"Hey, split up!"
OKOYE,They're trying to lose us.
NA.KIA,"We'll take the right. While the SECOND and FOURTH SUV skid left down a SINGLE LANE ROAD followed closely by... A skilled driver, Shuri shifts gears, darting left, in behind the trucks with Panther anchored atop."
SHURI,"We'll take the other two! I see a short cut. With the LEXUS LC closing in, the SECOND and FOURTH 4RUNNERS make a right turn, dropping down a STEEP HILL. Panther chases the SUV's off the hill. The lead SUV collides with a car in crossing traffic."
SHURI,We're not going to make it!
T'CHALLA,Keep go in g! Panther uses his claws to make a sharp turn and avoid the wreck.
SHURI,"Wool Brother! Panther catches up with the Rear SUV, he takes fire and leaps on the roof of the SUV. Panther rips the SUV roof open. The scared driver leaps out of the car, causing the SUV to collide with parked cars, ""Sidewinder''. Shuri runs over the escaped driver on accident."
SHURI,"Hey, what was that!?"
