character,line
NATASHA,We gotta stop him.
BARTON,Yeah? Who’s we?
NATASHA,I don’t know. Whoever is left.
BARTON,"Well, if I put an arrow through Loki’s eye socket I’d sleep better I suppose. "
NATASHA,Now you sound like you.
BARTON,"But you don’t. You’re a spy, not a soldier. Now you want to wade into a war. Why? What did Loki do to you? "
NATASHA,"He didn’t, I just- "
BARTON,Natasha.
NATASHA,I’ve been compromised. I got red in my ledger. I’d like to wipe it out.
STEVE,Was he married?
TONY,"No. There was a uh- cellist, I think. "
STEVE,I’m sorry. He seemed like a good man.
TONY,He was an idiot.
STEVE,Why? For believing?
TONY,For taking on Loki alone.
STEVE,He was doing his job.
TONY,He was out of his league. He should have waited. He should have-
STEVE,"Sometimes there isn’t a way out, Tony. "
TONY,Right. How did that work for him?
STEVE,Is this the first time you’ve lost a soldier?
TONY,We are not soldiers! I’m not marching to Fury’s fife.
STEVE,"Neither am I. He’s got the same blood on his hands that Loki does, but right now we gotta put that behind us and get this done. Now Loki needs a power source, if we can put together a list-"
TONY,He made it personal.
STEVE,That’s not the point.
TONY,That is the point. That’s Loki’s point. He hit us all right where we live. Why?
STEVE,To tear us apart.
TONY,"Yeah, divide and conquer is great but- he knows he has to take us out to win, right? That’s what he wants. He wants to beat us, he wants to be seen doing it. He wants an audience. "
STEVE,Right. I caught his act in Stuttgart.
TONY,"Yeah. That’s just previews, this is- this is opening night. And Loki, he’s a full-tail diva. He wants flowers, he wants parades, he wants a monument built to the skies with his name plastered....Son of-a-bitch."
CAPTAIN AMERICA,Time to go.
NATASHA,Go where?
CAPTAIN AMERICA,I’ll tell you on the way. Can you fly one of those jets?
BARTON,I can.
CAPTAIN AMERICA,Got a suit?
BARTON,Yeah.
CAPTAIN AMERICA,Then suit up.
SHIELD ENGINEER,"Hey, you guys aren’t authorized to be in here. "
CAPTAIN AMERICA,"Son, just don’t!"
MARIA HILL,Sir.
FURY,Agent Hill.
MARIA HILL,"Those cards, they were in Coulson’s locker, not in his jacket. "
FURY,They needed the push.
INTERCOM VOICE,We’ve got unauthorized departure from Bay Six.
FURY,"They found it. Get our communications back up, whatever you have to do. I want eyes on everything. "
MARIA HILL,"Yes, sir."
JARVIS,"Sir, I turned off the arc reactor. The device is already self-sustaining "
IRON MAN,"Shut it down, Dr. Selvig. "
SELVIG,It’s too late! She can’t stop now. She wants to show us something! A new universe.
IRON MAN,Okay.
JARVIS,The barrier is pure energy. It’s unbreachable.
IRON MAN,"Yeah, I got that.  I’m beat. "
JARVIS,"Sir, the Mark Seven is not ready for deployment. "
TONY,"Then skip the spinning rims, we’re on the clock."
LOKI,Please tell me you’re going to appeal to my humanity.
TONY,"Uh- actually, I’m planning to threaten you. "
LOKI,You should have left your armor on for that.
TONY,"Yeah, it’s seen a bit of mileage. You’ve got the uh- blue stick of destiny. Would you like a drink? "
LOKI,Stalling me won’t change anything.
TONY,"No, no, no- threatening. No drink? You sure? I’m having one. "
LOKI,"The Chitauri are coming, nothing will change that. What have I to fear? "
TONY,"The Avengers. It’s what we call ourselves, sort of like a team. ’Earth’s Mightiest Heroes’ type of thing. "
LOKI,"Yes, I’m met them. "
TONY,"Yeah, takes us a while to get any traction, I’ll give you that one. But, let’s do a head count here. Your brother, the Demi-God; A super soldier, a living legend who kind of lives up to the legend; a man with breath-taking anger management issues; a couple of master assassins, and you, big fella, you’ve managed to piss off every single one of them. "
LOKI,That was the plan.
TONY,"Not a great plan. When they come, and they will, they’ll come for you. "
LOKI,I have an army.
TONY,We have a Hulk.
LOKI,"Oh, I thought the beast had wandered off. "
TONY,"Yeah- you’re missing the point. There’s no throne, there is no version of this, where you come out on top. Maybe your army comes and maybe it’s too much for us, but it’s all on you. ’Cause if we can’t protect the earth, you can be damned well sure we’ll avenge it."
LOKI,"How will your friends have time for me, when they’re so busy fighting you? This usually works. "
TONY,"Well, performance issues. You know? JARVIS, anytime now."
LOKI,You will all fall before me.
TONY,JARVIS. Deploy.
TONY,Deploy!
IRON MAN,And there’s one other person you pissed off! His name is Phil.
TONY,Right! Army.
THOR,"Loki, turn off the Tesseract or I’ll destroy it! "
LOKI,You can’t. There is no stopping it. There is only the war!
THOR,So be it.
NATASHA,"Stark, we’re on a three heading north east."
TONY,"What, did you stop for drive-thru? Swing that park, I’m gonna lay ’em out for you."
JARVIS,"Sir, we have more incoming. "
TONY,Fine. Let’s keep them occupied.
BARTON,Nat!
NATASHA,I see ’em.
CAPTAIN AMERICA,We gotta get back up there.
CAPTAIN AMERICA,"Stark, are you seeing this? "
TONY,Seeing. still working on believing...
TONY,...Where’s Banner? Has he shown up yet?
CAPTAIN AMERICA,Banner?
TONY,"Just keep me posted.  JARVIS, find me a soft spot."
THOR,Look at this! Look around you! You think this madness will end with your rule?
LOKI,It’s too late. It’s too late to stop it.
THOR,"No. We can, together."
LOKI,Sentiment!
BARTON,We’ve got civilians trapped.
CAPTAIN AMERICA,Loki.  They’re fish in a barrel down there.
NATASHA,We got this. It’s good. Go!
CAPTAIN AMERICA,You think you can hold them off?
BARTON,"Captain, it would be my genuine pleasure."
NATASHA,Just like Budapest all over again!
BARTON,You and I remember Budapest very differently.
YOUNG COP,It’s gonna be an hour before they scramble the National Guard.
POLICE SERGEANT,National Guard!
POLICE SERGEANT,Does the army know what’s happening here?
YOUNG COP,Do we?
CAPTAIN AMERICA,"You need men in these buildings. There are people inside and they can be running right into the line of fire. You take them to the basement or through the subway, you keep them off the streets. I need a perimeter as far back as 39th. "
POLICE SERGEANT,Why the hell should I take orders from you?
POLICE SERGEANT,"I need men in those buildings, lead the people down and away from the streets. We gonna set up a perimeter all the way down to 39th street."
TONY,It noticed me... ...yay!
CAPTAIN AMERICA,What’s the story upstairs?
THOR,The power surrounding the cube is impenetrable.
TONY,"Thor is right, we gotta deal with these guys. "
NATASHA,How do we do this?
CAPTAIN AMERICA,As a team.
THOR,I have unfinished business with Loki.
BARTON,Oh yeah! Get in line.
CAPTAIN AMERICA,"Save it. Loki’s gonna keep this fight focused on us and that’s what we need. Without him these things could run wild. We got Stark up top, he’s gonna need us to-"
BANNER,"So, this all seems horrible. "
NATASHA,I’ve seen worse.
BANNER,Sorry.
NATASHA,"No, we could- use a little worse. "
CAPTAIN AMERICA,"Stark, we got him. "
TONY,Banner?
CAPTAIN AMERICA,Just like you said.
TONY,Then tell him to suit up. I’m bringing the party to you.
NATASHA,I don’t see how that’s a party.
CAPTAIN AMERICA,"Doctor Banner, now might be a really good time for you to get angry. "
BANNER,"That’s my secret, Cap. I’m always angry."
IRON MAN,Hold On!
LOKI,Send the rest.
NATASHA,Guys?
IRON MAN,"Call it, Captain. "
CAPTAIN AMERICA,"Alright, listen up. Until we can close that portal up there, we’re gonna use containment. Barton, I want you on that roof, eyes on everything. Call out patterns and strays. Stark, you got the perimeter. Anything gets more than three blocks out, you turn it back or you turn it to ash. "
BARTON,Wanna give me a lift?
IRON MAN,"Right. Better clench up, Legolas."
CAPTAIN AMERICA,"Thor! You gotta try and bottleneck that portal, slow ’em down. You got the lightning, light the bastards up."
CAPTAIN AMERICA,"You and me, we stay here on the ground, keep the fighting here. And Hulk!  Smash!"
MARIA HILL,Sir. The council is on.
BARTON,Stark. You gotta lot of strays on your tail.
TONY,Just tryin’ to keep them off the streets.
BARTON,Well they can’t bank worth a damn.
TONY,I will roger that.
TONY,Oh- boy.
TONY,Nice call. What else you got?
BARTON,"Well, Thor’s taking out a squadron down on 6th. "
TONY,And he didn’t invite me!
NATASHA,"Captain, none of this is gonna mean a damn thing if we don’t close that portal. "
CAPTAIN AMERICA,Our biggest guns couldn’t touch it.
NATASHA,"Well, maybe it’s not about guns. "
CAPTAIN AMERICA,"You wanna get up there, you’re gonna need a ride."
NATASHA,I got a ride. I could use a boost though.
CAPTAIN AMERICA,You sure about this?
NATASHA,"Yeah, it’s gonna be fun!"
NATASHA,"Turn, turn, Ah!"
BARTON,"Captain, the bank on 42nd, past Madison. They cornered a lot of civilians in there. "
CAPTAIN AMERICA,I’m on it.
CAPTAIN AMERICA,Everyone clear out!
COUNCILWOMAN,Director Fury. The council has made a decision...
FURY,"I recognize the council has made a decision, but given that it’s a stupid ass decision, I’ve elected to ignore it. "
COUNCILMAN,"Director, you’re closer than any of our subs, you scramble that jet-"
FURY,"That is the island of Manhattan, Councilman. "
FURY,"Until I’m certain my team can’t hold it, I will not order a nuclear strike against a civilian population. "
COUNCILMAN,"If we don’t hold them in the air, we lose everything. "
FURY,"I’d send that bird out, we already have."
NATASHA,Oh you! Hawkeye!
BARTON,"Nat, what are you doing? "
NATASHA,"Uh, a little help!"
BARTON,I got it.
LOKI,"ENOUGH! You are, all of you, beneath me! I AM GOD, YOU DULL CREATURE, AND I WILL NOT BE BULLIED BY-"
HULK,Puny God.
SELVIG,The scepter.
NATASHA,Doctor.
SELVIG,"Loki’s scepter, the energy- the Tesseract can’t fight. You can’t protect against yourself. "
NATASHA,It’s not your fault. You didn’t know what you were doing.
SELVIG,"Well, actually I think I did. I built in a safety to cut the power source. "
NATASHA,Loki’s scepter.
SELVIG,It may be able to close the portal. And I’m looking right at it.
JARVIS,"Sir, we will lose power before we penetrate that shell."
TONY,"JARVIS, you ever hear the tale of Jonah? "
JARVIS,I wouldn’t consider him a role model.
COUNCILWOMAN,Director Fury is no longer in command. Override seven-alpha-one-one.
JET PILOT,Seven-alpha-one-one confirmed. We’re go for takeoff.
MARIA HILL,"SIR, WE HAVE A BIRD IN MOTION! Anyone on the deck we have a rogue bird. We need to shut it down! Repeat, takeoff is not authorized!"
FURY,"Stark, you hear me? You have a missile headed straight for the city."
IRON MAN,How long?
FURY,Three minutes. Max. Stay load can wipe out mid-town.
TONY,"JARVIS, put everything we got into the thrusters. "
JARVIS,I just did.
JET PILOT,"Package is sent. Detonation in two minutes, thirty seconds. Mark."
THOR,You ready for another bout?
STEVE,"What, you gettin’ sleepy?"
SELVIG,Right at the crown!
NATASHA,I can close it. Can anybody copy? I can shut the portal down!
STEVE,Do it!
TONY,"No, wait. "
STEVE,"Stark, these things are still coming! "
TONY,"I got a nuke coming in, it’s gonna blow in less than a minute."
TONY,And I know just where to put it.
STEVE,"Stark, you know that’s a one way trip. "
TONY,Save the rest for the turn J.
JARVIS,"Sir, shall I try Miss Potts? "
TONY,Might as well.
REPORTER,Streets in New York City have become a battle ground. The army is here trying to contain the violence but clearly it is outmatch-
REPORTER,...Billionaire Tony Stark’s Iron Man-
JARVIS,"Sorry, Miss- "
NATASHA,"Come on, Stark. "
STEVE,Close it.
STEVE,Son of a gun!
THOR,He’s not slowing down.
TONY,What the hell? What just happened? Please tell me nobody kissed me.
STEVE,We won.
TONY,"Alright, Hey. Alright. Good job, guys. Let’s just not come in tomorrow. Let’s just take a day. You ever tried shawarma? There’s a shawarma joint about two blocks from here. I don’t know what it is, but I wanna try it. "
THOR,We’re not finished yet.
TONY,And then shawarma after?
LOKI,"If it’s all the same to you, I’ll have that drink now."
MALE REPORTER,Despite the dev...
MALE REPORTER,"...devastation of what has been confirmed as an extraterrestrial attack, the extraordinary heroics of the group known as the Avengers- "
MALE CITIZEN,"It’s really great knowing they’re out there, you know. That someone’s watching over us. "
FEMALE CITIZEN,"I love you, Thor! "
HUSBAND,I just don’t feel safe with those thing out there.
WIFE,It seems like there’s a lot they’re not telling us.
STAN LEE,Superheroes? In New York? Give me a break!
THE SENATOR,These so called heroes have to be held responsible for the destruction done to the city. This was their fight. Where are they now?
REPORTER,"Tough questions are being asked about the Avengers themselves, their sudden appearance and equally sudden disappearance. "
WAITRESS,"What, that this is all somehow their fault?"
WAITRESS,"Captain America saved my life. Wherever he is, and wherever any of them are, I would just- I would wanna say thank you."
COUNCILMAN 2,Where are the Avengers?
FURY,I’m not currently tracking their whereabouts. I’d say they’ve earned a leave of absence.
COUNCILWOMAN,And the Tesseract?
FURY,The Tesseract is where belongs...out of our reach.
COUNCILMAN,That’s not your call.
FURY,I didn’t make it. I just didn’t argue with the god that did.
COUNCILMAN,So you let him take it...
COUNCILMAN,"and the war criminal Loki, who should be answering for his crime. "
FURY,Oh I think he will be.
COUNCILWOMAN,I don’t think you understand what you’ve started...
COUNCILWOMAN,...letting The Avengers loose on this world. They’re dangerous.
FURY,"They surely are, and the whole world knows it. "
FURY,Every world knows it!
COUNCILMAN,Was that the point in all this? A statement.
FURY,A promise.
MARIA HILL,"Sir, how does it work now...?"
MARIA HILL,"...They’ve gone their separate ways, some pretty extremely far. We get into a situation like this again, what happens then? "
FURY,They’ll come back!
MARIA HILL,Really sure about that?
FURY,I am.
MARIA HILL,Why?
FURY,Because we’ll need them to.
THE OTHER,"The humans, they are not the cowering wretches we were promised. They stand. They are unruly and therefore cannot be ruled."
THE OTHER,"To challenge them, is to court Death."