character,line
LOKI,I don’t have it.  You need the Cube to bring me home but I’ve sent it off I know not where.
THOR,You listen well brother-
LOKI,I’m listening?
THOR,Do not touch me again.
TONY,Then don’t take my stuff.
THOR,You have no idea what you’re dealing with.
TONY,Uh- Shakespeare in the park? Doth mother know you wear-th her drapes?
THOR,"This is beyond you, metal man. Loki will face Asgardian justice. "
TONY,"He gives up the Cube, he’s all yours."
IRON MAN,-stay out of the way. Tourist.
TONY,Okay! 
JARVIS,Power at four hundred percent capacity.
TONY,How bout that?
CAPTAIN AMERICA,Hey!
CAPTAIN AMERICA,That’s enough!  Now I don’t know what you plan on doing here-
THOR,I’ve come here to put an end to Loki’s schemes!
CAPTAIN AMERICA,Then prove it. Put that hammer down.
IRON MAN,"Uh, yeah! No! Bad call, he loves his hammer- "
THOR,You want me to put hammer down?
CAPTAIN AMERICA,Are we done here?
FURY,"In case it’s unclear, you try to escape- you so much as scratch that glass- Thirty thousand feet straight down in a steel trap. You get how that works? Ant. Boot. "
LOKI,"It’s an impressive cage. Not built, I think, for me. "
FURY,Built for something a lot stronger than you.
LOKI,"Oh I’ve heard. A mindless beast- makes play he’s still a man... How desperate are you, that you call on such lost creatures to defend you? "
FURY,"How desperate am I?... You threaten my world with war, you steal a force you can’t hope to control, you talk about peace and you kill ’cause it’s fun. You have made me very desperate. You might not be glad that you did. "
LOKI,"Ooh. It burns you to have come so close, to have the Tesseract, to have power- unlimited power, and for what? A... warm light for all mankind to share? And then to be reminded what real power is."
FURY,"Well, let me know if ’real power’ wants a magazine or something. "
BANNER,He really grows on you doesn’t he?
STEVE,"Loki’s gonna drag this out. So, Thor, what’s his play? "
THOR,"He has an army called the Chitauri. They’re not of Asgard nor any world known. He means to lead the against your people. They will win him the Earth, in return, I suspect, for the Tesseract. "
STEVE,"An army, from outer space? "
BANNER,"So, he’s building another portal. That’s what he needs Erik Selvig for. "
THOR,Selvig?
BANNER,He’s an astrophysicist.
THOR,He’s a friend.
NATASHA,Loki has them under some kind of spell- along with one of ours.
STEVE,I wanna know why Loki let us take him. He’s not leading an army from here.
BANNER,"I don’t think we should be focusing on Loki. That guy’s brain is a bag full of cats, you can small crazy on him. "
THOR,"Have care how you speak. Loki is beyond reason but he is of Asgard, and he is my brother. "
NATASHA,He killed eighty people in two days.
THOR,He’s adopted?
BANNER,"I think it’s about the mechanics. Iridium, what do they need the Iridium for?"
TONY,"It’s a stabilizing agent. I’m saying, take a weekend; I’ll fly you to Portland. Keep love alive. Means the portal won’t collapse on itself like it did at SHIELD. No hard feelings point break, you got a mean swing."
TONY,"Also, means the portal can open as wide and stay open as long as Loki wants. Ah, raise the mizzen mast, ship the topsails. That man is playing Galaga! Thought we wouldn’t notice, but we did. How does Fury even see these? "
MARIA HILL,He turns!
TONY,"Sounds exhausting! The rest of the raw materials, Agent Barton can get his hands on pretty easily. Only major component he still needs is a power source- of high energy density. Something to- kick start the Cube. "
MARIA HILL,When did you become an expert in thermonuclear astrophysics?
TONY,"Last night. The packet, Selvig’s notes, the extraction theory papers- am I the only one who did the reading? "
STEVE,Does Loki need any particular kind of power source?
BANNER,He’s have to heat the Cube to a hundred and twenty million kelvin just to break through the Coulomb barrier.
TONY,"Unless, Selvig has figured out how to stabilize the Quantum Tunneling effect. "
BANNER,"Well, if he could do that he could achieve heavy-ion fusion at any reactor on the planet. "
TONY,Finally. Someone who speaks English.
STEVE,Is that what just happened?
TONY,"It’s good to meet you, Doctor Banner. Your work on anti-electronic collisions is unparalleled. And I’m a huge fan of the way you- lose control and turn into an enormous green rage monster. "
BANNER,...Thanks.
FURY,Doctor Banner is only here to track the Cube. I was hoping you might join him.
STEVE,I’d start with that stick of his. It may be magical but it works an awful lot like a HYDRA weapon.
FURY,"I don’t know about that, but it is powered by the Cube. And I like to know how Loki used it to turn two of the sharpest men I know into his personal flying monkeys. "
THOR,Monkeys? I do not understand-
STEVE,I do!
STEVE,I...I understood that reference.
TONY,"Shall we play, Doctor? "
BANNER,"This way, sir."
BANNER,The Gamma readings are definitely consistent with Selvig’s reports on the Tesseract. But it’s gonna take weeks to process.
TONY,If we bypass their mainframe and direct route to the Homer cluster we can clock this at around six hundred teraflops.
BANNER,All I packed was a toothbrush.
TONY,"You know, you should come by Stark Tower some time. Top ten floors- all R and D. You’d love it, it’s a candy land. "
BANNER,Thanks but...last time I was in New York I kind of broke...Harlem.
TONY,"Well, I promise a stress free environment. No tension, no surprises. He zaps Banner in the side. "
BANNER,Ow!
STEVE,Hey!
TONY,Nothing?
STEVE,Are you nuts?
TONY,"Jury’s out! You really have got a lid on it, haven’t you? What’s your secret? Mellow jazz, bongo drums, huge bag of weed? "
STEVE,Is everything a joke to you?
TONY,Funny things are.
STEVE,"Threatening the safety of everyone on this ship isn’t funny. No offense, Doc. "
BANNER,No it’s alright. I wouldn’t have come aboard if I couldn’t handle pointy things.
TONY,"You’re tip-toeing, big man. You need to strut. "
STEVE,"And you need to focus on the problem, Mister Stark. "
TONY,"You think I’m not? Why did Fury call us in? Why now, why not before? What isn’t he telling us? I can’t do the equation unless I have all the variables. "
STEVE,You think Fury’s hiding something?
TONY,"He’s a spy. Captain, he’s the spy. His secrets have secrets. It’s bugging him to, isn’t it? "
BANNER,"Uh, Aah, I just wanna finish my work here and- "
STEVE,Doctor?
BANNER,"A warm light for all mankind,"" Loki’s jab at Fury about the Cube. "
STEVE,I heard it.
BANNER,"Well, I think that was meant for you.  Even if Barton didn’t tell Loki about the tower, it was still all over the news. "
STEVE,The Stark Tower? That big ugly building in New York?
BANNER,"It’s powered by an arc reactor, self-sustaining energy source. That building will run itself for, what, a year? "
TONY,"It’s just the prototype. I’m kind of the only name in clean energy right now, that’s what he’s getting at. "
BANNER,"So, why didn’t SHIELD bring him in on the Tesseract project? What are they even doing in the energy business in the first place? "
TONY,I should probably look into that as soon as my decryption program finishes breaking into all of SHIELD’s secure files.
STEVE,I’m sorry did you say-
TONY,JARVIS has been running it since I hit the bridge. In a few hours I’ll know every dirty secret SHIELD has ever tried to hide. Blueberry?
STEVE,Yet you’re confused about why they didn’t want you around.
TONY,"An intelligence organization that fears intelligence? Historically, not awesome. "
STEVE,"I think Loki’s trying to wind us up. This is a man who means to start a war and if we don’t stay focused he’ll succeed. We have orders, we should follow them. "
TONY,Following’s not really my style.
STEVE,"And you’re all about style, aren’t you? "
TONY,"Out of the people in this room, which one is ""A"" wearing a spangly outfit and ""B"" not of use? "
BANNER,"Steve, tell me none of this smells a little funky to you? "
STEVE,Just find the Cube.
TONY,That’s the guy my dad never shut up about? Wondering if they shouldn’t have kept him on ice.
BANNER,"Guy’s not wrong about Loki, he does have the jump on us. "
TONY,"What he’s got is an ACME dynamite kit. It’s gonna blow up in his face, and I’m gonna be there when it does. "
BANNER,I’ll read all about it.
TONY,"Mhm, or, you’ll be suiting up with the rest of us. "
BANNER,"Now, you see I don’t get a suit of armor. I’m exposed, like a nerve, it’s a nightmare. "
TONY,"You know, I’ve got a cluster shrapnel, trying every second to crawl its way into my heart. This stops it- He taps the arc reactor. -this little circle of light. It’s part of me now, not just armor. It’s a terrible privilege. "
BANNER,But you can control it.
TONY,Because I learned how.
BANNER,It’s different. 
TONY,"Hey, I read all about your accident. That much Gamma exposure- should’ve killed you. "
BANNER,So you’re saying that the Hulk- the Other Guy- saved my life? That’s nice. That’s nice sentiment. Saved it for- what?
TONY,I guess we’ll find out.
BANNER,You may not enjoy that.
TONY,And you just might.
AGENT COULSON,As soon as Loki took the doctor we...
AGENT COULSON,"...moved Jane Foster. We’ve got an excellent observatory in Tromsø. She was asked to consult there very suddenly yesterday. Handsome fee, private plane, very remote. She’ll be safe. "
THOR,Thank you. It’s no accident Loki taking Erik Selvig. I dread what he plans for him once he’s done. Erik is a good man.
AGENT COULSON,He talks about you a lot. You changed his life. You changed everything around here.
THOR,"They were better as they were. We pretend on Asgard that we’re more advanced, but we- we come here battling like Bildschneip. "
AGENT COULSON,Like what?
THOR,"Bildschneip. You know, huge, scaly, big antlers. You don’t have those? "
AGENT COULSON,No.
THOR,"Huh! Well they are repulsive, and they trample everything in their path.  When I first came to earth, Loki’s rage followed me here and your people paid the price. And now again. In my youth I courted war. "
FURY,War hasn’t started yet. You think you can make Loki tell us where the Tesseract is?
THOR,"I do not know. Loki’s mind is far afield, it’s not just power he craves, it’s vengeance upon me. There’s no pain would prise his need from him. "
FURY,"A lot of guys think that, until the pain starts. "
THOR,What are you asking me to do?
FURY,"I’m asking, what are you prepared to do? "
THOR,Loki is a prisoner.
FURY,Then why do I feel like he’s the only person on this boat that wants to be here?
LOKI,Hm. There’s not many people that can sneak up on me.
NATASHA,But you figured I’d come.
LOKI,"After. After whatever tortures Fury can concoct, you would appear as a friend, as a balm. And I would cooperate. "
NATASHA,I wanna know what you’ve done to Agent Barton.
LOKI,I’d say I’ve expanded his mind.
NATASHA,And once you’ve won. Once you’re king of the mountain. What happens to his mind?
LOKI,"Is this love, Agent Romanoff? "
NATASHA,Love is for children. I owe him a debt.
LOKI,Tell me.
NATASHA,"Before I worked for SHIELD, I uh- well, I made a name for myself. I have a very specific skill set. I didn’t care who I used it for, or on. I got on SHIELD’s radar in a bad way. Agent Barton was sent to kill me, he made a different call. "
LOKI,And what will you do if I vow to spare him?
NATASHA,Not let you out.
LOKI,"Ah, no. But I like this. Your world in the balance, and you bargain for one man? "
NATASHA,"Regime’s fall everyday. I tend not to weep over that, I’m Russian, or I was. "
LOKI,And what are you now?
NATASHA,It’s really not that complicated. I got red in my ledger. I’d like to wipe it out.
LOKI,"Can you? Can you wipe out that much red? Drakov’s daughter? Sao Paulo? The hospital fire? Barton told me everything. Your ledger is dripping, it’s gushing red, and you think saving a man no more virtuous than yourself will change anything? This is the basest sentimentality. This is a child, a prayer. Pathetic."
LOKI,...You lie and kill in the service of liars...
LOKI,"...and killers. You pretend to be separate, to have your own code..."
LOKI,"...something that makes up for the horrors. But they are a part of you, and they will never go away."
LOKI,"I won’t touch Barton! Not until I make him kill you. Slowly, intimately, in every way he knows you fear.  And then he’ll wake just long enough to see his good work, and when he screams I’ll split his skull! This is my bargain, you mewling quim! "
NATASHA,You’re a monster!
LOKI,"Oh, no. You brought the monster."
NATASHA,"So, Banner? That’s your play. "
LOKI,What?
NATASHA,"Loki means to unleash the Hulk. Keep Banner in the lab, I’m on my way. Send Thor as well. Thank you, for your cooperation!"
FURY,"What are you doing, Mr. Stark? "
TONY,Uh- kind of been wondering the same thing about you.
FURY,You’re supposed to be locating the Tesseract.
BANNER,"We are, the model’s locked and we’re sweeping for the signature now. When we get a hit, we’ll have the location within half a mile. "
TONY,"And you’ll get your cube back, no muss, no fuss. What is Phase Two?"
STEVE,"Phase Two is SHIELD used the Cube to make weapons. Sorry, computer was moving a little slow for me. "
FURY,"Rogers, we gathered everything related to the Tesseract. This does not mean that we’re- "
TONY,"I’m sorry, Nick.  What were you lying? "
STEVE,"I was wrong, Director. The world hasn’t changed a bit."
BANNER,Did you know about this?
NATASHA,"You wanna think about removing yourself from this environment, doctor? "
BANNER,"I was in Calcutta, I was pretty well removed. "
NATASHA,Loki’s manipulating you.
BANNER,And you’ve been doing what exactly?
NATASHA,You didn’t come here because I bat my eyelashes at you.
BANNER,"Yes, and I’m not leaving because suddenly you get a little twitchy. "
BANNER,I’d like to know why SHIELD is using the Tesseract to build weapons of mass destruction.
FURY,Because of him.
THOR,Me?
FURY,"Last year earth had a visitor from another planet who had a grudge match that leveled a small town. We learned that not only are we not alone, but we are hopelessly- hilariously, out-gunned. "
THOR,My people want nothing but peace with your planet.
FURY,"But you’re not the only people out there, are you? And, you’re not the only threat. The world’s filling up with people who can’t be matched, they can’t be controlled. "
STEVE,Like you controlled the cube!
THOR,"Your work with the Tesseract is what drew Loki to it, and his allies. It is the signal to all the realms that the earth is ready for A HIGHER FORM OF WAR. "
STEVE,A higher form?!
FURY,You forced our hand! We had to come up with some-
TONY,Nuclear deterrent! ’Cause that always calms everything right down.
FURY,"Remind me again how you made your fortune, Stark? "
STEVE,"I’m sure if he still made weapons, Stark would be neck deep- "
TONY,Wait-Wait! Hold on! How is this now about me?
STEVE,"I’m sorry, isn’t everything? "
THOR,I thought humans were more evolved than this.
FURY,"Excuse me, did we come to your planet and blow stuff up? "
THOR,Tis your champion.
FURY,YOU’RE NOT MY CHAMPION!
NATASHA,Are you boys really that naive? S.H.I.E.L.D monitors potential threats.
TONY,You furious? I’m furious.
BANNER,And Captain America is on the threat poll?
NATASHA,We all are!
FURY,That’s not your concern doctor!
TONY,You’re on that list? Are you above or below angry bees?
STEVE,"I swear to God, Stark, one more crack... "
TONY,You’re a threat. VERBAL THREAT! I FEEL THREATENED!
STEVE,SHOW SOME RESPECT.
TONY,RESPECT WHAT!
BANNER,"YEAH MAN HANDLE ME NOW, THAT’LL BE GOOD!"
INTERCOM VOICE,Transport six-six-five-oh. Please relay your form code. Got you on the computer but not on the data log. What is your haul? Over.
PILOT,Arms to ammunition. Over.
THOR,"You speak of control, yet you court chaos! "
BANNER,"It’s his MO, isn’t it? I mean, what are we, a team? No, no, no. We’re a chemical mixture that makes chaos. We’re- we’re a time bomb. "
FURY,You need to step away.
TONY,Why shouldn’t they guy let off a little steam?
STEVE,You know damn well why! Back off!
TONY,"Oh, I’m starting to want you to make me. "
STEVE,"Yeah, big man in a suit of armor. Take that off, what are you? "
TONY,"Genius, billionaire, playboy, philanthropist. "
STEVE,"I know guys with none of that worth ten of you. I’ve seen the footage. The only thing you really fight for is yourself. You’re not the guy to make the sacrifice play, to lay down on a wire and let the other guy crawl over you. "
TONY,I think I would just cut the wire.
STEVE,"Always a way out. You know, you may not be a threat, but you better stop pretending to be a hero. "
TONY,"A hero, like you? You’re a laboratory experiment, Rogers. Everything special about you came out of a bottle."
STEVE,"Put on the suit, let’s go a few rounds. "
THOR,"You people are so petty, and tiny. "
BANNER,"Yeah, this is a team. "
FURY,"Agent Romanoff, would you escort Dr. Banner back to his- "
BANNER,WHERE? YOU RENTED MY ROOM!
FURY,The cell was just-
BANNER,"IN CASE YOU NEEDED TO KILL ME. BUT YOU CAN’T, I KNOW, I TRIED!  I got low. I didn’t see an end so I put a bullet in my mouth and the other guy spit it out. So I moved on, I focused on helping other people. I was good until you dragged me back into this freak show and put everyone here at risk. You wanna know my secret, Agent Romanoff? You wanna know how I stay calm?"
STEVE,"Doctor Banner, put down the scepter."
FURY,Got it!
BANNER,"Sorry, kids. You don’t get to see my party trick after all. "
THOR,Located the Tesseract?
TONY,I can get there faster.
STEVE,"Look, all of us- "
NOVAR,"The Tesseract belongs on Asgard, no human is a match for it."
STEVE,You’re not going alone!
TONY,You gonna stop me?
STEVE,"Put on the suit, let’s find out! "
TONY,I’m not afraid to hit an old man.
STEVE,Put on the suit.
BANNER,Oh-my-god.
STEVE,Put on the suit.
TONY,Yep.
INTERCOM VOICE,All hands engaged.
FURY,Hill!
MARIA HILL,Number Three engine is down.
FEMALE CARRIER BRIDGE TECH,We’ve been hit.
MARIA HILL,Did we get a run in? Talk to me.
OFF SCREEN WORKER,We got a fire in Engine Three.
CARRIER BRIDGE TECH 1,The line looks mostly in tact but it’s impossible to get out there to make repairs while we’re in the air.
MARIA HILL,We lose one more engine we won’t be. Somebody’s gotta get outside and patch that engine.
FURY,"Stark, you copy that? "
TONY,I’m on it.
FURY,"Coulson, initiate defensive lock down in the contingent center. Then get to the armory. "
FURY,Romanoff!
NATASHA,Okay!
NATASHA,"We’re okay, right?"
BARTON,"Keep that engine down. Detention, wait for camera to go dark. Stay close."
TONY,Find engine three. I’ll meet you there.
NATASHA,"Doctor? Bruce, you gotta fight it. This is just what Loki wants. We’re gonna be okay. Listen to me."
MAINTENANCE GUY,You hurt?
NATASHA,"We’re gonna be okay. Right? I swear on my life I will get you out of this, you will walk away, and never ever -- "
BANNER,Your life?
NATASHA,Bruce.
FURY,Bring the carrier to a one-eight-zero south. Take us to the water.
SHIELD AGENT,We’re blind. Navigation re calibrated after the engine failure.
FURY,Is the sun coming up?
SHIELD AGENT,"Yes, sir. "
FURY,Then put us on the left. Get us over water. One more turbine goes down then we drop.
STEVE,"Stark! Stark, I’m here."
IRON MAN,Good. Let’s see what we got.
TONY,"I gotta get this super conducting cooling system back online before I can access the rotors, work on dislodging the debris. "
IRON MAN,I need you to get to that engine control panel and tell me which relays are in overload position.
TONY,What’s it look like in there?
STEVE,It seems to run on some form of electricity.
TONY,"Well, you’re not wrong."
THOR,"We’re not your enemies, Banner! Try to think!"
STEVE,"’Kay, the relays are intact."
STEVE,What’s our next move?
IRON MAN,"Even if I clear the rotors, this thing won’t re-engage without a jump.... "
TONY,...I’m gonna have to get in there and push.
STEVE,"Well, if that thing gets up to speed, you’ll get shredded! "
TONY,Then stay in the control unit and reverse polarity long enough to disengage maglev and that should-
STEVE,Speak English!
TONY,See that red lever?  It’ll slow the rotors down long enough for me to get out.
TONY,"Stand by it, wait for my word."
FURY,We need full evac on the lower hangar bed.
MARIA HILL,GRENADE!
INTERCOM VOICE,We’ve got perimeter breach. Hostiles are in SHIELD gear. Call out to every junction.
INTERCOM VOICE,We’ve got the Hulk and Thor on Research Level Four. Levels Two and Three are gone.
MARIA HILL,"Sir, the Hulk will tear this place apart! "
FURY,Get his attention.
MARIA HILL,"Escort 6-Oh, proceed to Wishbone and..."
MARIA HILL,...engage hostile. Don’t get too close.
YOUNG SHIELD PILOT,Copy.
YOUNG SHIELD PILOT,Target acquired. Target engaged.
FURY,They are not getting through here so what the-
INTERCOM VOICE,Engine One is now in shutdown.
SHIELD WORKER,"Sir, we’ve lost all power in Engine One."
FURY,"It’s Barton, he took out our systems. He’s headed for the detention lab. Does anybody copy? "
NATASHA,This is Agent Romanoff. I copy. 
FURY,"Stark, we’re losing altitude. "
TONY,"Yep, noticed."
LOKI,Are you ever not going to fall for that?
LOKI,The humans think us immortal. Shall we test that?
AGENT COULSON,Move away please.  Do you like this? We started working on the prototype after you sent the Destroyer. Even I don’t know what it does. Do you wanna find out?
THOR,NO!
BARTON,Natasha!
AGENT COULSON,You’re going to lose.
LOKI,Am I?
AGENT COULSON,"It’s in your nature, "
LOKI,"your heroes are scattered, your floating fortress falls from the sky. Where is my disadvantage? "
AGENT COULSON,You lack conviction.
LOKI,I don’t think I-
AGENT COULSON,So that’s what it does.
INTERCOM VOICE,All hands to your stations immediately.
TONY,Cap hit the lever!
STEVE,i need a minute here!
TONY,Lever! Now!
TONY,Uh-oh.
AGENT COULSON,I’m sorry boss. They got rabbited.
FURY,Just stay awake. Eyes on me.
AGENT COULSON,Oh I’m clockin’ out here.
FURY,Not an option.
AGENT COULSON,"It’s okay, boss. This was never gonna work- if they didn’t have something- to"
FURY,Agent Coulson is down.
SHIELD WORKER,A medical team is on its way to your location.
FURY,They’re here.
FURY,They called it.
FURY,"These were in Phil Coulson’s jacket. Guess he never did get you to sign them.  We’re dead in the air up here. Our communications, location of the cube, Banner, Thor. I got nothing for you. Lost my one good eye. Think I had that coming.  Yes, we were going to build an arsenal with the Tesseract. I never put all my chips on that number, though, because I was playing something even riskier. There was an idea, Stark knows this, called the Avengers Initiative.   The idea was to bring together a group of remarkable people, see if they could become something more. See if they could work together when we needed them to, to fight the battles that we never could. Phil Coulson died still believing in that idea, in heroes.  Well, it’s an old fashioned notion."
SECURITY GUARD,You fell out of the sky.
BANNER,Did I hurt anyone?
SECURITY GUARD,There’s nobody around here to get hurt. You did scare the hell out of some pigeons though.
BANNER,Lucky.
SECURITY GUARD,Or just good aim. You were awake when you fell.
BANNER,You saw?
SECURITY GUARD,"The whole thing, right through the ceiling. Big and green and buck ass nude. Here- didn’t think those would fit you until you shrunk down to a regular size fella. "
BANNER,Thank you.
SECURITY GUARD,Are you an alien?
BANNER,What?
SECURITY GUARD,"From outer space, an alien? "
BANNER,No.
SECURITY GUARD,"Well then, son, you’ve got a condition."
SECURITY GUARD,"So, which one is it? "
BANNER,Sorry?
SECURITY GUARD,"Are you a big guy that gets all little, or a little guy that, ah- sometimes blows up large? "
BANNER,You know- I’m not even sure.
SECURITY GUARD,You got somewhere to go?
BANNER,Stark Tower. I- no. Yes.
SECURITY GUARD,"I’d expect some confusion of the mind, since your body’s kind of all over the place, but it has to be one or the other."
BANNER,"I know where I could do the most good, but it’s where I can do the most harm. "
SECURITY GUARD,"Well, that’s no different than anybody else. Me? I’m here is Jersey where I can’t do much of either. And since I’m not likely to move on from this placement, you may as well- pilfer my ride."
BANNER,I don’t know which way to go.
SECURITY GUARD,"Your mind’s already made up, son. The rest of you will follow."
NATASHA,"Clint, you’re gonna be alright. "
BARTON,You know that? Is that what you know? I gotta go in though. I have to flush him out.
NATASHA,"You gotta level out, it’s gonna take time. "
BARTON,You don’t understand. Have you ever had someone take your brain and play? Pull you out and stuff something else in? You know what it’s like to be unmade?
NATASHA,You know that I do.
BARTON,Why am I back? How did you get him out?
NATASHA,Cognitive recalibration. I hit you really hard in the head.
BARTON,"Thanks.  Natasha, how many agents? "
NATASHA,"Don’t. Don’t do that to yourself, Clint. This is Loki. This is monsters and magic and nothing we were ever trained for. "
BARTON,Loki. He get away?
NATASHA,Yeah. I don’t suppose you know where?
BARTON,Didn’t need to know. Didn’t ask. He’s gonna make his play soon though. Today.
