character,line
TONY,"You turning me down? You better think about this.  Look at that. Look at me. Last chance, yes or no?"
PETER,No.
TONY,"Okay. It’s kind of a Springsteen-y, working class hero vibe that I dig. Uh, Happy will take you home. Yeah?"
HAPPY,Yeah. Mind waiting in the car? I need a minute.
PETER,"Thank you, Mr. Stark."
TONY,"Yes, Mr. Parker. Very well."
PETER,See you around.
TONY,Okay.
PETER,"That was a test, right? There’s, uh, nobody back there?"
TONY,"Yes, you passed. All right, skedaddle there, young buck."
PETER,"Thank you, Mr. Stark. Thank you."
TONY,"Yeah, thank you."
HAPPY,Told you he’s a good kid.
PEPPER,Where’s the kid?
HAPPY,He left.
PEPPER,Everybody’s waiting.
TONY,You know what? He actually made a really mature choice. It just surprised the heck out of us.
PEPPER,Did you guys screw this up?
TONY,He told the kid to go wait in the car.
PEPPER,Are you kidding me? I have a room full of people in there waiting for some big announcement. What am I gonna tell them?
TONY,"Think of something. How about, um... Hap, you still got that ring?"
HAPPY,"Do I... I, uh..."
TONY,The engagement ring?
HAPPY,Are you kidding? I’ve been carrying this since 2008.
TONY,Okay.
PEPPER,I think I can think of something better than that.
TONY,"Well, it would buy us a little time."
TONY,Like we need time.
PEPPER,I can’t believe you have that thing in your pocket.
TONY,"Want me to get the door for you, hon?"
PEPPER,I got it.
PETER,"Aunt May, did you do dinner already?"
PETER,May?
MAY,What the fu...?
GARGAN,"Look who it is! What are the odds you and I’d end up in the same summer camp? Relax. This? It’s not on you. It’s on our, uh... little spider friend. I’ve got some boys on the outside who would love to meet him. You know, take a picture, slice his throat, put his head in a dryer. And I heard a rumor... you know who he is."
TOOMES,"If I knew who he was, he’d already be dead."
GUARD,"Toomes, your family’s here."
STEVE,Hi. I’m Captain America. Here to talk to you about one of the most valuable traits a soldier or student can have. Patience. Sometimes patience is the key to victory. Sometimes it leads to very little. It seems like it’s not worth it. And you wonder why you waited so long for something so disappointing.
STEVE,How many more of these?