character,line
PETER,"Listen, I was wondering if you could help me. I'm trying to figure out who the guys under the bridge were that night, but I mean, I can only kind of remember part of a license plate."
KAREN,I can run facial recognition on the footage of that encounter.
PETER,Footage?
KAREN,"Yes, Peter. I record everything you see."
PETER,Everything?
KAREN,Everything.
PETER,Like all the time?
KAREN,It's called the Baby Monitor Protocol.
PETER,"Yeah, of course it is. Um, yeah, just roll it back to last Friday."
KAREN,With pleasure.
PETER,"Hey, everyone. Yeah, kick-ass party. Hey, what's up, Liz? Peter's told me a lot about you."
PETER,"No, no, no. No, no, no. This is just me messing around. Go later in the day, later in the day."
PETER,"It is I, Thor, son of Odin!"
PETER,"No, no, no, no, no, no. That's definitely... no. That's definitely not what we wanted to watch. Just..."
KAREN,Your impressions are very funny.
PETER,Fast-forward to the arms deal.
PETER,"Okay. The two on the right, who are they?"
KAREN,Searching law enforcement databases. No records found for two of the individuals.
PETER,Nothing?
KAREN,"One individual identified. Aaron Davis, age 33. He has a criminal record and an address here in Queens."
PETER,Let's pay him a visit.
KAREN,Would you like me to activate the Enhanced Interrogation Protocol?
PETER,"Uh, yeah."
PETER,Remember me?
AARON,"Uh, hey..."
PETER,I need information. You're gonna give it to me now.
AARON,"All right, chill."
PETER,Come on!
AARON,What happened to your voice?
PETER,"What do you mean, what happened to my voice?"
AARON,I heard you by the bridge. I know what a girl sound like.
PETER,"I'm not a girl! I'm a boy. I mean, I'm a... I'm a man."
AARON,"I don't care what you are, a boy, a girl..."
PETER,"I'm not a girl! I'm a man. Come on, man. Look, who is selling these weapons? I need to know. Give me names or else."
AARON,"You ain't ever done this before, huh?"
PETER,Deactivate interrogation mode.
PETER,"Look, man, these guys are selling weapons that are crazy dangerous. They can't just be out on the streets. Look, if one of them can just cut Delmar's bodega in half..."
AARON,You know Delmar's?
PETER,"Yeah, best sandwich in Queens."
AARON,Sub Haven's pretty good.
PETER,It's too much bread.
AARON,I like bread.
PETER,"Come on, man, please."
PETER,"Stupid interrogation mode. Karen, don't ever do that again."
AARON,"The other night, you told that dude, ""if you shoot somebody, shoot me."" It's pretty ballsy. I don't want those weapons in this neighborhood. I got a nephew who live here."
PETER,Who are these guys? What can you tell me about the guy with the wings?
AARON,"Other than he's a psychopath dressed like a demon, nothing. I don't know who he is or where he is."
AARON,I do know where he's gonna be.
PETER,Really?
AARON,"Yeah, this crazy dude I used to work with, he's supposed to be doing a deal with him."
PETER,Yes! Yes. Thank-
AARON,Hey. Hey. Hey. I didn't tell you where. You don't have a location.
PETER,"Right, of course. Yeah, my bad. Silly. Just..."
PETER,Yeah. Where is it?
AARON,Can I give you some advice?
PETER,Hmm?
AARON,You got to get better at this part of the job.
PETER,I don't understand. I'm intimidating.
AARON,"Staten Island ferry, eleven."
PETER,"Oh, that's soon. Hey, that's gonna dissolve in two hours."
AARON,"No, no, no, no. Come fix this."
PETER,Two hours. You deserve that.
AARON,I got ice cream in here.
PETER,"You deserve that. You're a criminal. Bye, Mr. Criminal."
PETER,Nice.
PETER,"Okay, Karen, activate Enhanced Reconnaissance Mode."
KAREN,Sure thing.
TOOMES,He’s up front. Main deck.
SCHULTZ,I hate this guy.
PETER,"It’s the guy from the bridge, right? Who’s that other guy?"
TOOMES,Just keep me posted.
KAREN,There’s no record of him in my criminal database. Incoming call from May Peter. Should I reroute to your heads-up display?
PETER,I can’t talk right now. I’ll call her back.
PETER,"Hey, dronie, keep an eye on that guy. We can’t let anybody get away this time."
PETER,Who’s the guy on the left?
KAREN,"Mac Gargan. Extensive criminal record, including homicide. Would you like me to activate Instant Kill?"
PETER,"No, Karen, stop it with the Instant Kill already."
SCHULTZ,White pickup truck.
PETER,"Dronie, scan the ship for a white pickup truck."
PETER,"Oh, this is too perfect. I got the weapons, buyers, and sellers all in one place."
KAREN,Incoming call from Tony Stark.
PETER,"No, no, no. No, no, don’t answer."
TONY,Mr. Parker. Got a sec?
PETER,"Uh, I’m actually at school."
KAREN,"No, you’re not."
TONY,Nice work in D.C.
PETER,Okay.
TONY,My dad never really gave me a lot of support... And I’m just trying to break the cycle of shame.
PETER,"Uh, I’m kind of in the middle of something right now."
TONY,"Don’t cut me off when I’m complimenting you. Anyway, great things are about to-"
TONY,What is that?
PETER,"Uh, I’m at band practice."
TONY,That’s odd. Happy told me you quit band six weeks ago. What’s up?
PETER,"I gotta go. Uh, end call."
TONY,Hey.
PETER,I’ll take those!  Yoink!
PETER,"Hey, guys. The illegal-weapons-deal-ferry was at 10:30. You missed it."
RANDY,Spider guy’s here.
PETER,"Whoa, whoa, whoa. Not so fast."
PETER,Are you guys okay? My bad. That was a little hard.
PETER,I gotta say the other guy was way better with that thing.
PETER,"I’m honestly, I’m, I’m shocked."
FBI AGENT 1,Freeze! FBI!
FBI AGENT 2,Don’t move.
FBI AGENT 1,Get on the ground.
FBI AGENT 1,FBI.
PETER,"Wait, what do you mean, FBI?"
KAREN,The FBI is the Federal Bureau of Investigation.
PETER,"I know what the FBI means, but what are they doing here?"
PETER,Get out of the way! Get out of the way!
PETER,"Look out, look out, look out. Move, move, move!"
TOOMES,Get to the top deck. We’re getting out of here.
PETER,Activate Taser Web!
TOOMES,You’re messing with things you don’t understand.
PETER,"Oh, my god. What do I do? Karen, uh, give me an X-ray of the boat and target all the strongest points."
PETER,Web grenade. Web grenade.
PETER,"Splitter web, go."
KAREN,"Great job, Peter. You are 98 percent successful."
PETER,Ninety-eight?
MAN,"Yeah, Spider-Man!"
PETER,"No, no, no, no!"
PETER,No!
PETER,What the hell?
PETER,What the hell...
TONY,"Hi, Spider-Man. Band practice, was it?"
MAN,"Yeah, Iron Man!"
PETER,"Uh, Mr. Stark? Hey, Mr. Stark. Could I do anything? What do you want me to do?"
TONY,I think you’ve done enough.
TOOMES,"So that’s it, you’re just gonna run?"
SCHULTZ,"Feds were waiting for us. Now we’re on Iron Man’s radar? Yeah, I’m running. You should, too."
TOOMES,You know I can’t do that.
SCHULTZ,So now what?
TOOMES,"Mason, can you get that high-altitude seal thing up and running in time?"
MASON,Seriously? Yes. You will not regret this.
TOOMES,You in?
TONY,"Previously on Peter Screws the Pooch: I tell you to stay away from this. Instead, you hacked a multimillion-dollar suit so you could sneak around behind my back doing the one thing I told you not to do."
PETER,Is everyone okay?
TONY,No thanks to you.
PETER,No thanks to me?
PETER,"Those weapons were out there, and I tried to tell you about it. But you didn’t listen. None of this would’ve happened if you had just listened to me. If you even cared, you’d actually be here."
TONY,"I did listen, kid. Who do you think called the FBI, huh? Do you know that I was the only one who believed in you? Everyone else said I was crazy to recruit a 14-year-old kid."
PETER,I’m fifteen.
TONY,"No, this is where you zip it, all right? The adult is talking. What if somebody had died tonight? Different story, right? ‘Cause that’s on you. And if you died, I feel like that’s on me. I don’t need that on my conscience."
PETER,"Yes, sir."
TONY,Yes.
PETER,"I, I’m sorry."
TONY,Sorry doesn’t cut it.
PETER,I understand. I just wanted to be like you.
TONY,"And I wanted you to be better. Okay, it’s not working out. I’m gonna need the suit back."
PETER,For how long?
TONY,Forever.
TONY,"Yeah. Yeah, that’s how it works."
PETER,"No, no, no... Please, please, please..."
TONY,Let’s have it.
PETER,You don’t understand. Please. This is all I have. I’m nothing without this suit.
TONY,"If you’re nothing without this suit, then you shouldn’t have it. Okay? God, I sound like my dad."
PETER,I don’t have any other clothes.
TONY,"Okay, we’ll sort that out."
PETER,Hey.
MAY,I’ve been calling you all day. You didn’t answer your phone. You can’t do that. Then this ferry thing happens. I’ve called five police stations.
MAY,Five. I called five of your friends.
PETER,I’m fine.
MAY,I called Ned’s mother.
PETER,"May, I’m okay. Honestly. Just relax. I’m fine."
MAY,"You. Cut the bullshit. I know you left detention. I know you left the hotel room in Washington. I know you sneak out of this house every night. That’s not fine. Peter, you have to tell me what’s going on. Just lay it out. It’s just me and you."
PETER,I lost the Stark internship.
MAY,What?
PETER,Yeah.
MAY,What happened?
PETER,"I just thought that I could work really hard and he could, he would, you know. But I screwed it up."
MAY,"Oh... It’s okay, it’s okay. It’s okay."
PETER,I’m sorry I made you worry.
MAY,You know I’m not trying to ruin your life.
PETER,"Yeah, I know."
MAY,Just... I used to sneak out too.
PETER,Yeah.
MAY,And take a shower. You smell. You smell like garbage.
PETER,I know.
PRINCIPAL MORITA,"Peter, you’re a good kid and you’re a smart kid. So just try to keep your head straight, okay?"
PETER,Okay.
PRINCIPAL MORITA,All right. Get out of here.
NED,Are you expelled? Do you have to go to that high school on 46th where the principal has a crossbow?
PETER,"Pretty sure that’s an urban myth, and no, I’m not expelled."
NED,You’re so lucky.
PETER,I like doing homework.
SPANISH TEACHER,"Very good, Mr. Parker."
PETER,Hey.
LIZ,Hey.
PETER,I thought you had calculus fifth period.
LIZ,"Yeah, I was just doing some homecoming stuff."
PETER,"Hey, look, I, uh... I just wanted to apologize about the whole Decathlon thing. I really-"
LIZ,"It’s fine. Last week, Decathlon was the most important thing, but then I almost died."
PETER,"No, I, I just mean that... it was not cool, especially... because... I like you."
LIZ,I know.
PETER,You do?
LIZ,You’re terrible at keeping secrets.
PETER,"Yeah, you’d be surprised."
PETER,"I got to get to class, but, um, I’d say we should hang out, but I’m gonna be in detention for..."
LIZ,Uh-huh.
PETER,"...ever, but, um, I guess you already have a date to homecoming."
LIZ,"Actually, I was so busy planning it I never really got around to that part, so..."
PETER,"Uh, do you want to go with me?"
LIZ,Yeah. Sure.
PETER,"Really? I mean, uh, great. Cool."
LIZ,Cool.
PETER,I’m actually going that way.
PETER,"May, I need your help."
MAY,Right?
MAY,"It’s game day. So, what’s the plan?"
PETER,Open the door for her.
MAY,Mm-hmm.
PETER,"Tell her she looks nice, but not too much because that’s creepy."
MAY,Don’t be creepy.
PETER,"No. And, uh, when I dance with her, I’m putting my hands on her hips. I got this."
PETER,Love you.
MAY,Bye.
TOOMES,You must be Peter.
PETER,Yeah.
TOOMES,I’m Liz’s dad. Put her there.
TOOMES,Hell of a grip. Come on in here. Come on.
DORIS,"Hi, Peter. You look very handsome."
PETER,Thank you.
DORIS,You got his name right?
TOOMES,Freddie?
DORIS,Peter.
TOOMES,"Peter, Peter."
DORIS,I’m gonna go get Liz.
PETER,Okay.
TOOMES,"You all right, Pete?"
PETER,Yeah.
TOOMES,"Because you look pale. You want something to drink? Like a bourbon or a scotch, or something like that?"
PETER,I’m not old enough to drink.
TOOMES,That’s the right answer.
TOOMES,Wow.
TOOMES,"Wow, wow, wow. Do you look beautiful."
LIZ,"Please don’t embarrass me, Dad."
TOOMES,"Doesn’t she, Pete?"
PETER,"Yeah, you look really good."
TOOMES,"Once again, that’s the right answer."
LIZ,Is that a corsage?
LIZ,Thanks.
TOOMES,"Well, hey, I’m your chauffeur, so, uh, let’s get this show on the road."
DORIS,"No, no, no, no, we have to take some pictures, babe. All right. Oh, right here. Perfect."
LIZ,Mom.
DORIS,"Okay. Come on, you guys. Peter, closer."
DORIS,Smile. There you go.
PETER,"Sir, you don’t have to drive us."
TOOMES,"No, no, it’s not a big deal. I’m going out of town. It’s right on my way."
DORIS,He’s always coming and going.
TOOMES,Last time.
DORIS,Have fun.
LIZ,Thank you.
TOOMES,Promise.
DORIS,He’s cute.
LIZ,Shh.
TOOMES,See you in a couple of days.
DORIS,"Bye, baby."
TOOMES,All right.
TOOMES,"Come on, Pedro."
DORIS,"Bye, Peter. Have fun."
PETER,"Yeah, I will."
TOOMES,"What are you gonna do, Pete?"
PETER,What?
TOOMES,"When you graduate, what do you think you’re gonna do?"
PETER,"Oh, um, I don’t know."
LIZ,"Don’t grill him, Dad."
TOOMES,"Just saying, you know. All you guys who go to that school, you pretty much have your life planned out, right?"
PETER,"Yeah, no, I’m just a sophomore."
LIZ,Peter has an internship with Tony Stark. So I think he doesn’t have to worry.
TOOMES,Really?
LIZ,Mm-hmm.
TOOMES,Stark?
LIZ,So cool.
TOOMES,What do you do?
PETER,"Yeah, actually, I don’t intern for him anymore."
LIZ,Seriously?
PETER,"Yeah, it got, um... boring."
LIZ,It was boring? You got to hang out with Spider-Man.
TOOMES,Really? Spider-Man? Wow. What’s he like?
PETER,"Yeah, he’s nice. Nice man. Solid dude."
TOOMES,Hmm.
LIZ,"Look, so cute."
PETER,Aww...
TOOMES,"I’ve seen you around, right? I mean... Somewhere. We’ve, uh, have we ever? Because even the voice..."
LIZ,"Um, he does Academic Decathlon with me."
TOOMES,Oh.
LIZ,And he was at my party.
TOOMES,Ah.
PETER,"It was a great party, really great, yeah. Beautiful house, a lot of windows."
LIZ,"You were there for, like, two seconds."
PETER,That was... I was there longer than two seconds.
LIZ,You disappeared.
PETER,"No, no. I did not disappear."
LIZ,"Yes, you did. You disappeared like you always do. Like you did in D.C., too."
TOOMES,"That’s terrible, what happened down there in D.C., though. Were you scared?"
TOOMES,"I’ll bet you were glad when your old pal Spider-Man showed up in the elevator, though, huh?"
PETER,"Yeah, well, I actually didn’t go up. I saw it all from the ground."
LIZ,Yeah.
PETER,Very lucky that he was there that day.
TOOMES,Good old Spider-Man.
LIZ,"Dad, the light."
TOOMES,Here we are. End of the line.
LIZ,"Thanks, Dad."
TOOMES,"You head in there, gumdrop. I’m gonna give Peter the, uh, the “dad talk.”"
LIZ,Don’t let him intimidate you.
LIZ,Love you.
TOOMES,"Love you, gumdrop."
LIZ,Have a safe flight.
LIZ,Hi! You guys look so pretty.
TOOMES,Does she know?
PETER,Know what?
TOOMES,So she doesn’t. Good. Close to the vest. I admire that. I’ve got a few secrets of my own. Of all the reasons I didn’t want my daughter to date...
TOOMES,"Peter, nothing is more important than family. You saved my daughter’s life. I could never forget something like that. So I’m gonna give you one chance. Are you ready? You walk through those doors, you forget any of this happened. And don’t you ever, ever interfere with my business again. Because if you do, I’ll kill you and everybody you love. I’ll kill you dead. That’s what I’ll do to protect my family. Do you understand?"
TOOMES,"Hey. I just saved your life. Now, what do you say?"
PETER,Thank you.
TOOMES,"You’re welcome. Now, you go in there and you show my daughter a good time, okay? Just not too good."
LIZ,Hey. What did he say to you?
PETER,"Gotta go. I’m, I’m sorry. You don’t deserve this."
SCHULTZ,He gave you a choice. You chose wrong.
PETER,"Ah, what the hell?"
SCHULTZ,What’s with the crappy costume?
PETER,My web-shooters...
SCHULTZ,"I wasn’t sure about this thing at first, but damn."
PETER,Ugh. Gross.
PETER,Why did he send you here?
SCHULTZ,Guess you’ll never know.
PETER,Nice shot!
PETER,"Yes! Ned, the guy with the wings is Liz’s dad."
NED,What?
PETER,"I know. I gotta tell Mr. Stark. Call Happy Hogan. He’s Mr. Stark’s head of security. And, uh, get a computer to track my phone for me."
NED,Are you gonna be okay?
PETER,"Hurry, we gotta catch him before he leaves town."
FLASH,"I’m sorry about dinner, but I know when branzino’s fresh, and that was not fresh, okay? So..."
PETER,"Flash, I need your car and your phone."
FLASH,"Uh, sir, technically, this is my dad’s car, sir. So I can’t..."
PETER,"Hello, Ned? Hey, hey, hey, hey, can you hear me?"
NED,Go for Ned.
PETER,"Ned, I need you to track my phone for me."
NED,"Yeah, but where is it?"
NED,"Genius move. Okay, he just passed the GameStop on Jackson Avenue."
PETER,"Hey, where are the headlights on this thing? I’m in Flash’s car."
NED,I’ll pull the specs.
PETER,"Okay, you’re on speakerphone."
NED,You stole Flash’s car. Awesome.
PETER,"Yeah, it’s awesome. It’s awe... Whoa!"
PETER,"Get out of the way, get out of the way! Move! Move!"
NED,"Peter, are you okay?"
PETER,I’ve never really driven before. Only with May in parking lots. This is a huge step up...
PETER,"Hey, have you gotten through to Happy yet?"
NED,Yeah. I’m working on it. I just gotta backdoor the phone system.
NED,Guy in the chair.
HAPPY,Takeoff in nine minutes. Hello? Hello? Who is this?
NED,"Uh... Mr. Happy, it’s Ned."
HAPPY,Who?
NED,I’m an associate of Peter Parker. Got something very important to tell you-
HAPPY,You gotta be shitting me.
NED,Damn.
PETER,"Hey, Ned, how we coming on with those headlights?"
NED,"Uh... Round knob to the left of the steering wheel, turn clockwise."
PETER,"Left. Okay. Okay, perfect. So where’s my phone now?"
NED,Um... He stopped in an old industrial park in Brooklyn.
PETER,What? That makes no sense. I thought he said he was going out of town!
NED,"Weird. Oh, I reached Mr. Happy. Don’t think he likes you, by the way. It sounded like he was catching a flight. He said something about taking off in nine minutes."
PETER,What?
NED,He was surrounded by a bunch of boxes.
PETER,Boxes? It’s moving day. It’s moving day! It’s moving day! He’s gonna rob that plane! I gotta stop him!
HAPPY,"All right, wheels up in eight minutes. We just got to load Tony’s old Hulkbuster armor, prototype for Cap’s new shield, and the Meging... the Meg... the... Thor’s magic belt."
NED,"Okay, slow down. You’re getting close. It’s on your right."
PETER,What?
NED,Turn right! Turn right!
NED,"Peter, are you okay?"
PETER,Yeah. Just keep trying to get through to Happy.
NED,"It’s been an honor, Spider-Man."
MS. WARREN,What are you doing here? There’s a dance.
NED,Uh...
NED,I’m... looking... at... porn.
PETER,Hey! Surprised?
TOOMES,"Oh, hey, Pete. I didn’t hear you come in."
PETER,It’s over. I’ve got you.
TOOMES,"You know, I gotta tell you, Pete, I really, really admire your grit. I see why Liz likes you. I do. When you first came to the house, I wasn’t sure. I thought, “Really?” But I get it now."
PETER,How could you do this to her?
TOOMES,"To her? I’m not doing anything to her, Pete. I’m doing this for her."
PETER,"Huh, yeah."
TOOMES,"Peter, you’re young. You don’t understand how the world works."
PETER,"Yeah, but I understand that selling weapons to criminals is wrong."
TOOMES,"How do you think your buddy Stark paid for that tower? Or any of his little toys? Those people, Pete, those people up there, the rich and the powerful, they do whatever they want. Guys like us, like you and me, they don’t care about us. We build their roads and we fight all their wars and everything, but they don’t care about us. We have to pick up after ‘em. We have to eat their table scraps. That’s how it is. I know you know what I’m talking about, Peter."
PETER,Why are you telling me this?
TOOMES,Because I want you to understand. And... I needed a little time to get her airborne.
TOOMES,"I’m sorry, Peter."
PETER,What are you talking about? That thing hasn’t even touched me yet.
TOOMES,"True. Then again, wasn’t really trying to."
MASON,"Chief, they’re powering up engines."
TOOMES,Okay.
MASON,"Come on, come on, come on."
TOOMES,"Yeah, yeah."
PETER,"Oh, god. Okay, ready?"
PETER,"Hello! Hello! Please. Hey, hey, please. I’m down here. I’m down here. I’m stuck. I’m stuck. I can’t move. I can’t..."
TONY,"If you’re nothing without this suit, then you shouldn’t have it."
PETER,"Come on, Peter. Come on, Spider-Man. Come on, Spider-Man. Come on, Spider-Man. Come on, Spider-Man!"
MASON,Launch for intercept. Green light. Green light.
TOOMES,"Oh, yeah."
TECH,Retro-reflective panels engaged.
TOOMES,"Got a visual on the plane, feeling a little resistance."
MASON,It’s probably just a drag on the new turbines.
PETER,Ah! Whoa!
MASON,Look out for the cloaking cameras. Stay in the blind spots.
PETER,"Oh, my god! Oh, my god!"
MASON,Deploy high-altitude vacuum seal.
TOOMES,"This better work, Mason."
MASON,"Trust me, boss. Even one of those boxes and we are set for life."
TOOMES,Yeah.
PETER,Hey! Ah! Whew.
MASON,You have thirty seconds to get to the cockpit and override their security.
TOOMES,Cloning transponder signal.
MASON,Launching decoy drone.
TOOMES,Entering new coordinates.
HAPPY,"Good, so it’s on its way?"
TECH,"Yes, sir, right on course."
HAPPY,"Okay, thank you. All right."
TOOMES,Hot dog.
PETER,Just a typical homecoming on the outside of an invisible jet... Fighting my girlfriend’s dad.
PETER,"Oh, god!"
PETER,Whew. I can’t believe that worked.
MASON,"Chief, chief, they’re losing altitude. Get out of there."
TOOMES,I’m not going home empty-handed.
PETER,"Oh, my god."
MASON,Get out of there! What are you doing?
PETER,Please turn! Please turn!
TOOMES,"Hey, Pedro."
TOOMES,Bingo.
PETER,Your wing suit. Your wing suit’s gonna explode!
TOOMES,"Time to go home, Pete."
PETER,I’m trying to save you!
PETER,No.
NED,"It looked so insane. That whole... Like, it was just crazy. He, he was just like, “Zzzz,” and you were like, “Ah!”"
PETER,Shh.
NED,"And then I just hit him with the “pew.” It was so, oh, my god."
PETER,You saved me. It was awesome.
PETER,"Hey, Liz!"
BETTY,I’m gonna miss you.
LIZ,Bye.
PETER,Liz.
PETER,"Liz, look. I’m so sorry."
LIZ,You say that a lot. What are you sorry for this time?
LIZ,The dance? That was a pretty crappy thing to do.
PETER,"Well, yeah, but I... I mean, your dad... I can’t imagine what you’re going through. If there’s anything I can do to help..."
LIZ,"I guess we’re moving to Oregon. Mom says it’s nice there, so that’s cool. Anyways, Dad doesn’t want us here during the trial, so..."
PETER,"Liz, I... I..."
LIZ,"Bye, Peter. Whatever’s going on with you, I hope you figure it out."
MR. HARRINGTON,"Congratulations, Decathlon national champions."
DECATHLON TEAM,Yeah!
MR. HARRINGTON,"I’m gonna have to put this back in the trophy case soon, but just for motivation right now at this practice. I’m a little ahead of the game, but we will need a new team captain next year. So I’m appointing Michelle."
DECATHLON TEAM,Yeah!
MICHELLE,"Uh, thank you. My friends call me M.J."
NED,I thought you didn’t have any friends.
MICHELLE,I didn’t.
PETER,I... I gotta go.
MICHELLE,"Hey, where you going?"
MICHELLE,"What are you hiding, Peter?"
MICHELLE,"I’m just kidding. I don’t care. Bye. All right, so we should run some drills."
NED,Yeah.
PETER,"Hey, Happy. What, uh... What are you doing here?"
HAPPY,"I really owe you one. I don’t know what I would do without this job. I mean, before I met Tony-"
PETER,"So, uh, how long you been here?"
HAPPY,Long enough to be awkward. Boss wants to see you.
PETER,Is he here too?
HAPPY,"In the toilet? No, he’s upstate."
PETER,"Upstate? Like, upstate-upstate?"
HAPPY,"Yeah, let’s go."
HAPPY,"Take a look. It’s pretty impressive, huh?"
HAPPY,They just finished remodeling the whole thing.
HAPPY,You don’t see that every day.
TONY,"Oh, there they are. How was the ride up?"
HAPPY,Good.
TONY,Give me a minute with the kid.
HAPPY,Seriously?
TONY,Yeah. I gotta talk to the kid.
HAPPY,I’ll be close behind.
TONY,How about a loose follow? All right? Boundaries are good.
TONY,"Sorry I took your suit. I mean, you had it coming. Actually, it turns out it was the perfect sort of tough-love moment that you needed, right? To urge you on, right? Wouldn’t you think? Don’t you think?"
PETER,"Yeah, yeah, I guess."
TONY,Let’s just say it was.
PETER,"Mr. Stark, I really-"
TONY,"You screwed the pooch hard. Big time. But then you did the right thing. Took the dog to the free clinic, you raised the hybrid puppies... All right, not my best analogy. I was wrong about you. I think, with a little more mentoring, you could be a real asset to the team."
PETER,To the... To the team?
TONY,"Yeah. Anyway... There’s about fifty reporters behind that door. Real ones, not bloggers."
TONY,When you’re ready... Why don’t you try that on? And I’ll introduce the world to the newest official member of the Avengers: Spider-Man.
PETER,I...
TONY,Yeah. Give that a look.
TONY,"So, after the press conference, Happy will show you to your room, your new quarters. Where’s he between? He’s next to Vision?"
HAPPY,"Yeah, Vision’s not big on doors."
TONY,It’s fun.
HAPPY,Or walls.
TONY,You’ll fit right in.
PETER,"Thank you, Mr. Stark. But I’m good."
TONY,You’re good? Good? How are you good?
PETER,"Well, I mean, I’m... I’d rather just stay on the ground for a little while. Friendly neighborhood Spider-Man. Somebody’s got to look out for the little guy, right?"
